id,created_at,text
3.59848E+17,24/07/2013 01:31,b'Si EPN quisiera modernizar a PEMEX bastar\xc3\xada con limpiarla de corrupci\xc3\xb3n. Pero no. Su propuesta de privatizaci\xc3\xb3n es m\xc3\xa1s saqueo. Ladrones!'
3.59475E+17,23/07/2013 00:46,b'Hoy se anuncia que EPN  presentar\xc3\xa1 en agosto su propuesta para privatizar el petr\xc3\xb3leo. Defendamos a la patria de corruptos y traidores'
3.58398E+17,20/07/2013 01:30,b'Dicen que no vender\xc3\xa1n ni un tornillo de PEMEX. En la CFE tampoco vendieron ni un foco y el 50% de la energ\xc3\xada ya es privada y muy cara'
3.58044E+17,19/07/2013 02:03,b'La propuesta de la \xc3\xa9lite del PAN de privatizar el petr\xc3\xb3leo reafirma su papel de achichincles. Paleros. Secuaces de EPN. Traidores a M\xc3\xa9xico'
3.57694E+17,18/07/2013 02:49,"b'Recordemos con respeto a Ju\xc3\xa1rez, liberal y patriota; Madero, ap\xc3\xb3stol de la democracia y C\xc3\xa1rdenas, por su profundo amor al pueblo de M\xc3\xa9xico'"
3.57316E+17,17/07/2013 01:47,"b'A donde quiera que voy es lo mismo: quejas sobre la falta de obras, de circulante y empleos; mientras que EPN sigue solo con sus anuncios'"
3.56953E+17,16/07/2013 01:44,"b'Los consejeros del IFE, en defensa de sus 400 mil pesos mensuales, pusieron estrellita a EPN y nos multan por ""rebasar"" el tope de campa\xc3\xb1a'"
3.56577E+17,15/07/2013 00:51,"b'Terminamos gira de 4 d\xc3\xadas por Guerrero: Tlapa, Chilapa, Chilpancingo, Iguala, Altamirano, Zihuatanejo, Tecpan, Atoyac y Coyuca. MORENA va'"
3.56257E+17,14/07/2013 03:42,"b'En 7 meses de EPN solo anuncios de TV, ninguna obra iniciada. La industria de la construcci\xc3\xb3n decrece 1.7% y ha dejado de crear empleos'"
3.56254E+17,14/07/2013 03:27,"b'Hoy volvimos a cruzar la Sierra de Altamirano a Zihuatanejo, 172 kms en 4 hrs. Eso har\xc3\xadamos desde el DF si esta carretera se modernizara'"
3.55886E+17,13/07/2013 03:05,"b'Como el pozol de Tabasco, el tascalate de Chiapas, en Guerrero hay una bebida fresca y deliciosa hecha con arroz y cacao llamada chilate'"
3.55865E+17,13/07/2013 01:42,"b'Como lo dijimos, la imposici\xc3\xb3n de EPN, profundiz\xc3\xb3 la crisis. Solo hay corrupci\xc3\xb3n, desempleo, pobreza, carest\xc3\xada, violencia y desilusi\xc3\xb3n'"
3.55441E+17,11/07/2013 21:37,"b'En Tlapa, Macedonio Mendoza nos dio la bienvenida y habl\xc3\xb3 llorando que ""descalzos, con ropa remendada, con hambre"" siguen de pie y en lucha'"
3.55039E+17,10/07/2013 19:00,b'Chuayffet compar\xc3\xb3 a EPN con Madero cuando no es m\xc3\xa1s que un t\xc3\xadtere de Salinas. Pruebas: las fraudulentas elecciones y la foto con Claudio X'
3.54407E+17,09/07/2013 01:11,"b'Hoy se acord\xc3\xb3 que MORENA convoque al Z\xc3\xb3calo, el domingo 8 de septiembre, para evitar el aumento del IVA y la privatizaci\xc3\xb3n del petr\xc3\xb3leo'"
3.53688E+17,07/07/2013 01:31,b'Voceros de EPN dec\xc3\xadan que el aumento a la gasolina cada mes era porque costaba menos aqu\xc3\xad que en EU. Ahora es al rev\xc3\xa9s y sigue subiendo'
3.53337E+17,06/07/2013 02:16,"b'Si EPN fuera un dem\xc3\xb3crata, en v\xc3\xadsperas de estas elecciones, no habr\xc3\xada el ambiente de violencia, manipulaci\xc3\xb3n y truculencia que prevalece'"
3.52977E+17,05/07/2013 02:25,b'Nuestro proyecto propone fortalecer a las clases medias. El sistema actual las empobrece porque su fin es beneficiar al 1% de la poblaci\xc3\xb3n'
3.52601E+17,04/07/2013 01:31,b'En Monterrey recog\xc3\xad la preocupaci\xc3\xb3n de empresarios por la incertidumbre econ\xc3\xb3mica. Hay riesgos de recesi\xc3\xb3n y fuga de capitales golondrinos'
3.52223E+17,03/07/2013 00:30,b'Inici\xc3\xb3 en Monterrey el segundo curso de formaci\xc3\xb3n pol\xc3\xadtica a 300 j\xc3\xb3venes del norte del pa\xc3\xads. Sembrar ideas para cosechar buenos l\xc3\xadderes'
3.52042E+17,02/07/2013 12:33,"b'Hace un a\xc3\xb1o, comprando voluntades, millones de votos, la mafia del poder impuso a EPN para mantener la corrupci\xc3\xb3n como forma de gobierno'"
3.51689E+17,01/07/2013 13:09,"b'Iniciamos bien en el Distrito Federal. Como siempre, mucha gente l\xc3\xbacida, consciente y comprometida, adem\xc3\xa1s muy buenos dirigentes de MORENA'"
3.51162E+17,30/06/2013 02:16,"b'Ayer Tecamachalco y Tepeaca. Hoy Teziutl\xc3\xa1n y Zacapoaxtla. Ma\xc3\xb1ana DF: Tlalpan a las 10, V. Carranza a las 13 hrs y Benito Ju\xc3\xa1rez a las 4pm'"
3.50652E+17,28/06/2013 16:27,b'Vuelvo a aclarar con detalle el monto y la forma c\xc3\xb3mo se ejerci\xc3\xb3 y comprob\xc3\xb3 el gasto en mi campa\xc3\xb1a a la presidencia http://t.co/nRt6IpVTbA'
3.5065E+17,28/06/2013 16:20,"b'Reitero: ejerc\xc3\xad y comprob\xc3\xa9 233 millones, 100 abajo del tope pero los inefables del IFE-TRIFE buscan equipararme con el corrupto de EPN...'"
3.50649E+17,28/06/2013 16:16,"b'Los del IFE-TRIFE nos condenan y exoneran al corrupto de EPN. Los compran y envilecen con 400 mil al mes. Reina el maiceo, no la dignidad'"
3.50436E+17,28/06/2013 02:08,b'Hoy visitamos Ajalpan y Tehuac\xc3\xa1n. En Puebla ganamos a pesar de que EPN y el PRI compraron votos. La gente mantiene la fe en el cambio'
3.50283E+17,27/06/2013 16:04,"b'Luego que en Televisa me aplican la m\xc3\xa1xima de que ""ni me ven ni me oyen"", ahora se atreven a preguntar qu\xc3\xa9 estoy haciendo. No mamipulen'"
3.49696E+17,26/06/2013 01:08,b'NO a la reforma al 27 Constitucional ni a leyes secundarias para el robo de la renta petrolera. S\xc3\x8d al combate a la corrupci\xc3\xb3n en PEMEX'
3.49328E+17,25/06/2013 00:46,b'EPN desatendi\xc3\xb3 el asunto de la Reforma Migratoria. En EU decidieron solos como si no importara que sellen la frontera con crisis en M\xc3\xa9xico'
3.48998E+17,24/06/2013 02:54,"b'Con los actos de hoy en Monterrey y Nuevo Laredo, concluimos los estados del norte, solo nos falta BCS. La semana pr\xc3\xb3xima Puebla y DF'"
3.48917E+17,23/06/2013 21:32,"b'La Reforma Migratoria beneficia a nuestros paisanos, pero el precio de sellar la frontera, con crisis en M\xc3\xa9xico, ser\xc3\xa1 grav\xc3\xadsimo. Y EPN?'"
3.48915E+17,23/06/2013 21:25,"b'Seg\xc3\xban Jorge Ramos, pol\xc3\xadticos de EU acordaron la reforma migratoria a cambio de 1200 km m\xc3\xa1s de muro y de 21 mil nuevos polic\xc3\xadas fronterizos'"
3.48648E+17,23/06/2013 03:46,b'Terminamos la gira por Guanajuato. Este pueblo bueno y trabajador ha sido vilmente enga\xc3\xb1ado por el PRIAN. La alternancia fue pura transa'
3.4853E+17,22/06/2013 19:55,"b'La ineptitud de EPN se muestra en el subejercicio presupuestal. No hay obras ni trabajo. Lleva 6 meses con pura TV, viajes y cooptaci\xc3\xb3n'"
3.4827E+17,22/06/2013 02:43,"b'Ayer en Ac\xc3\xa1mbaro y Morole\xc3\xb3n; hoy Charco de Pantoja y Celaya. Desde abajo y con la gente, se conoce la realidad que omite a prop\xc3\xb3sito la TV'"
3.47912E+17,21/06/2013 02:59,b'El caso Granier es muestra de la impunidad reinante. Como aport\xc3\xb3 dinero a la campa\xc3\xb1a de EPN le toleran hasta que ofenda con su desfachatez'
3.47755E+17,20/06/2013 16:38,"b'En tanto, los verdaderos jefes, desde sus yates de 180 mdd, traman el pr\xc3\xb3ximo ""negocio"" y celebran con champagne por no pagar impuestos'"
3.47754E+17,20/06/2013 16:33,b'Los legisladores aprueban a los ministros sueldos de 600 mil pesos mensuales y EPN se encarga de que siga operando la red de complicidades'
3.47753E+17,20/06/2013 16:29,"b'No es gobierno, es asociaci\xc3\xb3n delictuosa. Los ministros resolvieron no transparentar los bienes de los legisladores y con ello los de EPN'"
3.47029E+17,18/06/2013 16:32,b'A EPN le sobra tiempo para viajar. Por ahora solo tiene dos encargos: aumentar impuestos y privatizar el petr\xc3\xb3leo. Falta que lo permitamos'
3.46072E+17,16/06/2013 01:07,b'Hoy tres buenas asambleas en ciudades fronterizas de Tamaulipas. Regresamos al DF para participar ma\xc3\xb1ana en el Consejo Nacional de MORENA'
3.45737E+17,15/06/2013 02:57,"b'Desde ayer estamos en Tamaulipas: Cd. Madero, Tampico, Cd. Mante y Victoria. Ma\xc3\xb1ana Matamoros, R\xc3\xado Bravo y Reynosa. La misi\xc3\xb3n es MORENA'"
3.45368E+17,14/06/2013 02:32,"b'En la PGR domin\xc3\xb3 el dinero de Granier para la campa\xc3\xb1a de EPN. En Tabasco debe prevalecer la justicia, lo exige la gente. No a la impunidad'"
3.4521E+17,13/06/2013 16:03,b'Que acaso la PGR no sabe c\xc3\xb3mo Granier manej\xc3\xb3 los fondos federales o le hacen al cuento por aquello del dinero aportado a la campa\xc3\xb1a de EPN'
3.44621E+17,12/06/2013 01:02,b'Impusieron a EPN para mantener la corrupci\xc3\xb3n y est\xc3\xa1n como enajenados destruyendo al pa\xc3\xads. Creen que manipulando noticias ser\xc3\xa1n eternos'
3.43918E+17,10/06/2013 02:30,"b'Anoche nos invitaron a cenar empresarios de Monterrey preocupados por la recesi\xc3\xb3n econ\xc3\xb3mica. Hoy actos en Sta Catarina, Escobedo y Apodaca'"
3.43831E+17,09/06/2013 20:45,"b'Ahora que est\xc3\xa1 declarando el extesorero de Granier, valdr\xc3\xada preguntarle cu\xc3\xa1nto dinero del erario de Tabasco se destin\xc3\xb3 a la campa\xc3\xb1a de EPN'"
3.43516E+17,08/06/2013 23:54,"b'Ayer San Pedro y Torre\xc3\xb3n. Hoy Saltillo; Cadereyta y Guadalupe, NL. A donde quiera que vamos hay crisis econ\xc3\xb3mica, desempleo e inseguridad'"
3.4307E+17,07/06/2013 18:22,"b'Estoy en Coahuila. De aqu\xc3\xad sali\xc3\xb3 mucho dinero, como del erario de Tabasco para la campa\xc3\xb1a de EPN, por eso se protege a Moreira y a Granier'"
3.42813E+17,07/06/2013 01:20,"b'Estuvimos en Piedras Negras y en Monclova, Coahuila. Hay elecciones y aqu\xc3\xad s\xc3\xad aplica, como en otros lados, que no hay a qui\xc3\xa9n elegir'"
3.42066E+17,04/06/2013 23:51,"b'Con Fox vendieron Banamex en 12,500mdd sin impuestos; con EPN venden la Modelo en 18mmdd y no pagan 5,400mdd de impuestos. Viva la equidad'"
3.4139E+17,03/06/2013 03:06,"b'Ayer tomamos protesta a comit\xc3\xa9s en Aguascalientes, Jes\xc3\xbas Mar\xc3\xada y San Francisco del Rinc\xc3\xb3n. Hoy P\xc3\xa9njamo, Irapuato y Le\xc3\xb3n. MORENA avanza'"
3.4087E+17,01/06/2013 16:40,"b'6 meses perdidos: econom\xc3\xada estancada, desempleo, carest\xc3\xada, empobrecimiento, violencia, corrupci\xc3\xb3n y EPN en la indolencia y la frivolidad'"
3.40672E+17,01/06/2013 03:32,"b'Visitamos Jerez, Fresnillo, Guadalupe y Zacatecas. Hay pobreza extrema, pero el gobernador ""del nuevo PRI"" compra ranchos y caballos finos'"
3.40536E+17,31/05/2013 18:29,"b'Ma\xc3\xb1ana aumentar\xc3\xa1 otra vez la gasolina y se cumplen 6 meses del gobierno medi\xc3\xa1tico de EPN. Si antes todo iba mal, ahora todo a empeorado'"
3.40127E+17,30/05/2013 15:27,b'EPN protege a Granier porque se benefici\xc3\xb3 en la campa\xc3\xb1a con dinero il\xc3\xadcito de Tabasco. Por eso Hacienda no informa y demoran el juicio'
3.38793E+17,26/05/2013 23:05,"b'Ayer S.L.P., San Luis de La Paz y San Miguel de Allende. Hoy Quer\xc3\xa9taro, Cadereyta y San Juan del R\xc3\xado. Vamos al DF a despedirnos de Chema'"
3.38676E+17,26/05/2013 15:20,"b'Falleci\xc3\xb3 nuestro querido amigo Chema P\xc3\xa9rez Gay. Gran intelectual con dimensi\xc3\xb3n \xc3\xa9tica y social, lleno de bondad. Abrazos a Lilita y familia'"
3.38386E+17,25/05/2013 20:08,"b'Solo el atraso y la corrupci\xc3\xb3n que impera en la \xc3\xa9lite pol\xc3\xadtica de Espa\xc3\xb1a, explica que ese gobierno condecore al funesto de Felipe Calder\xc3\xb3n'"
3.38144E+17,25/05/2013 04:06,"b'Avanza la organizaci\xc3\xb3n de MORENA. Ayer y hoy tomamos protesta a comit\xc3\xa9s municipales en Linares, NL; Matehuala, R\xc3\xado Verde y Soledad, SLP'"
3.38102E+17,25/05/2013 01:20,"b'Lamento el fallecimiento de Arnoldo Mart\xc3\xadnez Verdugo, un pol\xc3\xadtico consecuente, ejemplo de honestidad. Un abrazo a sus familiares y amigos'"
3.37956E+17,24/05/2013 15:38,"b'Crecimiento 0.8%; desempleo como nunca; inflaci\xc3\xb3n 4.7, la m\xc3\xa1s alta en 4 a\xc3\xb1os y superior al aumento del 3.9 al salario. EPN= a despe\xc3\xb1adero'"
3.37648E+17,23/05/2013 19:16,"b'La ""billetiza"" encontrada en Tabasco es apenas un shishito del gran saqueo cometido a mi entra\xc3\xb1able estado. EPN no protejas a Granier!'"
3.36664E+17,21/05/2013 02:04,b'La \xc3\xbanica opci\xc3\xb3n es cambiar al r\xc3\xa9gimen. Sigamos construyendo la esperanza de M\xc3\xa9xico #Af\xc3\xadliateaMORENAenL\xc3\xadnea http://t.co/ctIEHmLMqc'
3.36322E+17,20/05/2013 03:24,"b'Hoy 3 Asambleas en la Huasteca: Huejutla, Tamazunchale y Cd. Valles. Abandono del campo y de la actividad productiva, desempleo y pobreza'"
3.3589E+17,18/05/2013 22:47,"b'Hoy fue Ixmiquilpan, Actopan y Pachuca, Hgo. Tierra de gente buena y trabajadora con pol\xc3\xadticos de talla nacional... mediocres y ladrones'"
3.35565E+17,18/05/2013 01:17,"b'Ayer Atizap\xc3\xa1n y Tlalnepantla, hoy Tula y Naucalpan. Terminamos 31 mpios del Edo M\xc3\xa9x. Ma\xc3\xb1ana a Hidalgo. Otro estado con corrupci\xc3\xb3n y pobreza'"
3.35507E+17,17/05/2013 21:27,"b'Crecimiento 0.8%; cay\xc3\xb3 la construcci\xc3\xb3n 2.3% y manufacturas 1.6%. El aumento mayor en ""informaci\xc3\xb3n en medios masivos"" 6.3%. El circo de EPN'"
3.35165E+17,16/05/2013 22:49,"b'En serio y con todo respeto. Ten\xc3\xadamos raz\xc3\xb3n o no, cuando antes que nadie dijimos que era lo mismo Salinas, Diego, Fox, Calder\xc3\xb3n, EPN, etc.'"
3.34836E+17,16/05/2013 01:01,"b'En Teotihuac\xc3\xa1n y Texcoco felicit\xc3\xa9 a maestras y maestros. Es con ellos y no contra ellos, como debe garantizarse el derecho a la educaci\xc3\xb3n'"
3.34746E+17,15/05/2013 19:04,b'Avi\xc3\xb3n y helic\xc3\xb3pteros para EPN; sobornos en PEMEX y condonaci\xc3\xb3n a Televisa. El hubiera existe. La opci\xc3\xb3n es la honestidad y la justicia'
3.34499E+17,15/05/2013 02:42,b'400 consorcios con 5 billones de ingresos al a\xc3\xb1o declaran de ISR 1.7% y se les devuelve. EPN le condon\xc3\xb3 impuestos a Televisa por 3mmdp'
3.33735E+17,13/05/2013 00:05,"b'La visita hoy a Ixtapaluca, Valle de Chalco y Chalco reafirma lo dicho: el Edo M\xc3\xa9x es el laboratorio de la corrupci\xc3\xb3n que engendra pobreza'"
3.33375E+17,12/05/2013 00:15,"b'En Chimalhuac\xc3\xa1n, Los Reyes y Neza dije: 3 mil millones para combatir el hambre, lo mismo que le condonan de impuestos a Televisa. Descaro'"
3.32624E+17,09/05/2013 22:33,"b'Como ser\xc3\xa1n de da\xc3\xb1inas las reformas para aumentar el IVA y entregar la renta petrolera, que las aplicar\xc3\xa1n despu\xc3\xa9s de las elecciones de julio'"
3.31861E+17,07/05/2013 19:59,"b'Los medios promueven la comedia del Pacto, pero callan ante el aumento del costo de la luz, cuando EPN ofreci\xc3\xb3 bajarla. A qu\xc3\xa9 se debe?'"
3.31821E+17,07/05/2013 17:21,b'Lamento la tragedia en Ecatepec. Mi m\xc3\xa1s profundo p\xc3\xa9same a los familiares y amigos de las v\xc3\xadctimas'
3.31429E+17,06/05/2013 15:23,b'Lo dijimos: aprob\xc3\xb3 el Congreso el Plan Energ\xc3\xa9tico de EPN y ya entr\xc3\xb3 en vigor. En mayo aumentar\xc3\xa1 8.4% el precio de la luz a la clase media'
3.31176E+17,05/05/2013 22:38,"b'Ayer Tec\xc3\xa1mac, Tultepec y Cuatitl\xc3\xa1n. Hoy Tultitl\xc3\xa1n, Coacalaco y Ecatepec. Van 79 Comit\xc3\xa9s Municipales. Se hace camino al andar: Machado'"
3.30712E+17,04/05/2013 15:54,"b'La gasolina en M\xc3\xa9xico cuesta m\xc3\xa1s que en EU y han decidido seguirla aumentando. EPN no seas caradura e insensible, no abuses. Te pasas...'"
3.30474E+17,04/05/2013 00:10,b'Ma\xc3\xb1ana el sexto gasolinazo de EPN. Por eso muchos seguimos luchando. Ayer Jilotepec y Teoloyucan. Hoy Nicol\xc3\xa1s Romero y Cuautitl\xc3\xa1n Izcalli'
3.30362E+17,03/05/2013 16:44,b'El colmo: EPN no sabe las capitales de los estados y Joaqu\xc3\xadn confunde Provida con el Derecho Universal a la vida proclamado por Roosevelt'
3.30052E+17,02/05/2013 20:11,"b'10.- Presidente Obama: con respeto, cumpla con su compromiso de reforma migratoria. Garantice el derecho universal a la vida. P\xc3\xa1sela bien'"
3.30051E+17,02/05/2013 20:09,"b'9.- Por todo lo anterior es que existe MORENA, para cambiar al r\xc3\xa9gimen, en paz, con la participaci\xc3\xb3n libre y organizada de los ciudadanos'"
3.30051E+17,02/05/2013 20:07,"b'8.- Un dato: el 1er trimestre de este a\xc3\xb1o la econom\xc3\xada creci\xc3\xb3 1%, mientras en Michoac\xc3\xa1n hubo 189 homicidios, el \xc3\xadndice m\xc3\xa1s alto en d\xc3\xa9cadas'"
3.30051E+17,02/05/2013 20:06,"b'7.- Por eso, d\xc3\xada a d\xc3\xada, se agrava m\xc3\xa1s la crisis econ\xc3\xb3mica, de bienestar social, de inseguridad y violencia. O sea, contin\xc3\xbaa la decadencia'"
3.3005E+17,02/05/2013 20:04,"b'6.- L\xc3\xb3gico, EPN est\xc3\xa1 al servicio de sus patrocinadores y convertido en personaje de escenograf\xc3\xada no atiende las causas de la degradaci\xc3\xb3n'"
3.3005E+17,02/05/2013 20:02,"b'5.- En la pasada elecci\xc3\xb3n presidencial, el grupo que domina impuso a EPN con el apoyo de los medios y con la compra de millones de votos..'"
3.30049E+17,02/05/2013 20:01,"b'4.- A nivel nacional solo hay 5 espacios: 3 en prensa y 2 en radio, no controlados por los mandones de M\xc3\xa9xico. Cobertura de apenas 0.5%'"
3.30049E+17,02/05/2013 20:00,b'3.- La \xc3\xa9lite de poder se opone al cambio verdadero y se impone porque son due\xc3\xb1os o controlan a la mayor\xc3\xada de los medios de informaci\xc3\xb3n...'
3.30048E+17,02/05/2013 19:55,"b'2.- La econom\xc3\xada lleva 30 a\xc3\xb1os sin crecer y se produjo desempleo masivo, migraci\xc3\xb3n, pobreza, descomposici\xc3\xb3n social, inseguridad y violencia'"
3.30048E+17,02/05/2013 19:54,b'1.- Contin\xc3\xbaa la crisis en M\xc3\xa9xico porque no hay democracia y se mantiene la misma pol\xc3\xadtica de corrupci\xc3\xb3n e injusticias a favor de muy pocos'
3.30047E+17,02/05/2013 19:51,"b'Presidente Obama: un informe b\xc3\xa1sico solo para su conocimiento por tratarse de asuntos de nuestra soberan\xc3\xada, y una solicitud respetuosa...'"
3.29795E+17,02/05/2013 03:11,"b'Triste d\xc3\xada del Trabajo. Hay una profunda crisis por falta de crecimiento econ\xc3\xb3mico y empleos, con el a\xc3\xb1adido de bajos salarios y carest\xc3\xada'"
3.29073E+17,30/04/2013 03:20,"b'Una buena: ma\xc3\xb1ana concluyen las sesiones en las C\xc3\xa1maras, aunque regresan en septiembre para aumentar el IVA y privatizar el petr\xc3\xb3leo'"
3.28659E+17,28/04/2013 23:55,"b'Tomamos protesta a Comit\xc3\xa9s Municipales de los distritos de Tenancingo, Metepec y Huixquilucan. Hombres y mujeres ejemplares, fraternos'"
3.283E+17,28/04/2013 00:11,"b'Hoy Atlacomulco, Ixtlahuaca y Toluca. Por sus gobernantes ladrones el Edo M\xc3\xa9x es 1er lugar en pobres: 7 millones. Y treparon a lo nacional'"
3.27957E+17,27/04/2013 01:26,"b'Estuvimos en Tejupilco. Un joven dijo que los opresores temen m\xc3\xa1s a un pueblo consciente y organizado, que a un pueblo enojado y violento'"
3.27604E+17,26/04/2013 02:02,"b'En Zit\xc3\xa1cuaro terminamos la gira por Michoac\xc3\xa1n y en Valle de Bravo iniciamos un recorrido por Edo Mex, entidad de opulencia e indigencia'"
3.27466E+17,25/04/2013 16:55,"b'La C\xc3\xa1mara de Diputados o tianguis de la transa, aprob\xc3\xb3 una Ley para vender terrenos de pol\xc3\xadticos corruptos a extranjeros en las playas'"
3.27256E+17,25/04/2013 03:01,"b'Reitero: superar la crisis implica crecer al 6%, generar empleos, atender a los j\xc3\xb3venes, erradicar la corrupci\xc3\xb3n, fortalecer valores....'"
3.26881E+17,24/04/2013 02:10,b'Rezago aparte. Se crece para atender 35% de la demanda de empleos. Muchos est\xc3\xa1n en la sobrevivencia. Por desgracia aumenta la frustraci\xc3\xb3n'
3.26519E+17,23/04/2013 02:13,"b'Te invito a MORENA. Podemos cambiar el r\xc3\xa9gimen de corrupci\xc3\xb3n, en paz, con la participaci\xc3\xb3n organizada y consciente de ciudadanos como t\xc3\xba'"
3.26186E+17,22/04/2013 04:09,"b'En Michoac\xc3\xa1n 189 homicidios en el 1er trimestre del a\xc3\xb1o, el m\xc3\xa1s alto en d\xc3\xa9cadas. EPN deja la pantomima y atiende las calamidades del pa\xc3\xads'"
3.2581E+17,21/04/2013 03:15,"b'Hoy tres municipios de Michoac\xc3\xa1n: Puru\xc3\xa1ndiro, Jiquilpan y Zamora. Lo mismo, abandono y temor pero tambi\xc3\xa9n gente esperanzada y consciente'"
3.25444E+17,20/04/2013 03:02,"b'Visitamos Uruapan y P\xc3\xa1tzcuaro. La situaci\xc3\xb3n en Michoac\xc3\xa1n es lamentable: en vez de desarrollo y empleo hay incertidumbre, miedo y violencia'"
3.25286E+17,19/04/2013 16:33,"b'En el mundo del espect\xc3\xa1culo: manipulaci\xc3\xb3n y ""reformas"" a favor de los jefes de EPN. En el real desempleo, carest\xc3\xada, corrupci\xc3\xb3n y violencia'"
3.25075E+17,19/04/2013 02:36,"b'Estuve en L\xc3\xa1zaro C\xc3\xa1rdenas y Apatzing\xc3\xa1n. A pesar de la violencia, la gente participa y busca el cambio para alcanzar la justicia y la paz'"
3.24884E+17,18/04/2013 13:54,"b'Los del PRIAN se acusan de compra de votos y reparto masivo de d\xc3\xa1divas con prop\xc3\xb3sitos electorales. Recuerden: as\xc3\xad ""ganaron"" Calderon y EPN'"
3.24328E+17,17/04/2013 01:05,"b'Mis condolencias por las muertes en Boston y en Venezuela, la violencia no es la v\xc3\xada solo produce sufrimiento y perpet\xc3\xbaa el autoritarismo'"
3.23989E+17,16/04/2013 02:40,b'Bien por el recuento en Venezuela. En 2006 gobiernos y organismos internacionales callaron. Calder\xc3\xb3n y su comparsa se negaron al votoXvoto'
3.2361E+17,15/04/2013 01:33,b'Fuimos testigos de la elecci\xc3\xb3n de Comit\xc3\xa9s Municipales en Bah\xc3\xada de Banderas y Puerto Vallarta. Gracias a todos por participar en MORENA'
3.2326E+17,14/04/2013 02:23,"b'Reuniones en San Juan de los Lagos, Tepatitl\xc3\xa1n y Zapopan. El objetivo superior de MORENA es cambiar al r\xc3\xa9gimen caduco por la v\xc3\xada pac\xc3\xadfica'"
3.22898E+17,13/04/2013 02:23,"b'Estuvimos en Cd Guzm\xc3\xa1n, la tierra de Clemente Orozco, Juan Jos\xc3\xa9 Arreola y Consuelito Vel\xc3\xa1zquez. Tambi\xc3\xa9n en Tlaquepaque construyendo MORENA'"
3.22535E+17,12/04/2013 02:20,"b'Hoy, toma de protesta de Comit\xc3\xa9s de MORENA en Manzanillo y Colima. Dirigentes j\xc3\xb3venes. Vladimir Parra, presidente en Colima, tiene 25 a\xc3\xb1os'"
3.2217E+17,11/04/2013 02:12,"b'Para Televisa y Duarte: C\xc3\xa9sar Camacho de Delicias me entrevist\xc3\xb3, y de Cablem\xc3\xa1s le informan que el 30 termina su contrato. Y la libertad?'"
3.22153E+17,11/04/2013 01:03,"b'Un d\xc3\xada como hoy, en 1919, fue asesinado cobardemente Emiliano Zapata Salazar, leal defensor de los campesinos y aut\xc3\xa9ntico l\xc3\xadder social....'"
3.218E+17,10/04/2013 01:40,"b'Hoy se aprob\xc3\xb3 en la C\xc3\xa1mara de Diputados el plan de EPN para aumentar, a\xc3\xban m\xc3\xa1s, el precio de las gasolinas, diesel, gas y la luz. B\xc3\xa1rbaros!'"
3.21432E+17,09/04/2013 01:18,"b'EPN: la oposici\xc3\xb3n a la llamada Reforma Educativa no debe enfrentarse con difamaci\xc3\xb3n en los medios, amenazas y menos con represi\xc3\xb3n. Di\xc3\xa1logo'"
3.21063E+17,08/04/2013 00:50,"b'Ayer Delicias y Cuauht\xc3\xa9moc, hoy Chihuahua y Cd. Ju\xc3\xa1rez. Aqu\xc3\xad adem\xc3\xa1s les tom\xc3\xa9 protesta a Comit\xc3\xa9s de MORENA de Guadalupe, Pr\xc3\xa1xedis y El Paso'"
3.20667E+17,06/04/2013 22:40,"b'Fox: MORENA no es para obtener ""mucha lana"", sino para cambiar al r\xc3\xa9gimen corrupto. No soy como t\xc3\xba: hip\xc3\xb3crita, traidorzuelo y ladr\xc3\xb3n'"
3.20656E+17,06/04/2013 21:56,b'Quinto gasolinazo de EPN. Esta es la realidad. Siguen ahondando la crisis econ\xc3\xb3mica y de bienestar social. Lo dem\xc3\xa1s es puro choro mareador'
3.20391E+17,06/04/2013 04:23,"b'Ayer Durango y Guadalupe Victoria. Hoy G\xc3\xb3mez Palacio y Parral. Vamos a una entrevista de TV en Delicias. Jornada intensa, pero fruct\xc3\xadfera'"
3.20001E+17,05/04/2013 02:34,"b'Nuestra solidaridad con David y Ricardo Monreal. Cortina de humo, intimidaci\xc3\xb3n, terror y de parte de qui\xc3\xa9n? Debe saberse pronto la verdad'"
3.19647E+17,04/04/2013 03:07,"b'La industria agoniza y no hay empleos, pero EPN va a China a reforzar la tendencia importadora en vez de impulsar la industria nacional'"
3.1929E+17,03/04/2013 03:26,"b'Mi sincero p\xc3\xa9same para amigos y familiares de Luis Tom\xc3\xa1s Cervantes Cabeza de Vaca, dirigente del hist\xc3\xb3rico movimiento estudiantil del 68'"
3.18938E+17,02/04/2013 04:06,"b'EPN apuesta a ocultar homicidios como lo hizo en Edo. M\xc3\xa9x. y a cambiar la percepci\xc3\xb3n con la TV. Por desgracia, sin desarrollo, no hay paz'"
3.1737E+17,28/03/2013 20:17,b'Es la semana del hombre que fue sacrificado para dejarnos la ense\xc3\xb1anza de enfrentar el mal con el bien y renunciar a la Ley del Tali\xc3\xb3n'
3.17102E+17,28/03/2013 02:31,"b'Circo de EPN aparte. Lo cierto es que contin\xc3\xbaa la pol\xc3\xadtica econ\xc3\xb3mica que durante 30 a\xc3\xb1os solo a dejado corrupci\xc3\xb3n, desempleo y violencia'"
3.16643E+17,26/03/2013 20:10,b'Estoy saliendo de la UAM. Asist\xc3\xad al examen de doctorado de Beatriz. Su tesis es una investigaci\xc3\xb3n de un libro de Quevedo sobre Job. Aprob\xc3\xb3'
3.16575E+17,26/03/2013 15:36,"b'El mundo al rev\xc3\xa9s: Felipe Rodr\xc3\xadguez, honesto defensor de los pobres, est\xc3\xa1 preso acusado de pandillerismo por Murillo Karam, Eruviel y EPN'"
3.16207E+17,25/03/2013 15:16,"b'Libertad a Felipe Rodr\xc3\xadguez, dirigente social de la UPREZ, encarcelado injustamente por consigna del gobernador del Edo. Mex. y de EPN'"
3.16043E+17,25/03/2013 04:23,"b'Hoy fuimos a La Barca, Tonal\xc3\xa1 y Guadalajara. Avanzamos en organizaci\xc3\xb3n, tarea compleja pero indispensable para cambiar el r\xc3\xa9gimen corrupto'"
3.15669E+17,24/03/2013 03:38,"b'Hoy estuvimos en Autl\xc3\xa1n, Jocotepec y Tlajomulco. Los dirigentes de MORENA en Jalisco trabajan bien, han integrado 27 Comit\xc3\xa9s Municipales'"
3.15279E+17,23/03/2013 01:49,"b'Hoy se eligieron los Comit\xc3\xa9s Municipales de Compostela, Nay. y en Tequila, Jal. Es satisfactorio constatar la participaci\xc3\xb3n de los j\xc3\xb3venes'"
