id,created_at,text
1.10698E+17,05/09/2011 12:56,"b'Con s\xc3\xb3lo 3 decisiones se tendr\xc3\xada presupuesto para crear empleos, generar bienestar y garantizar la seguridad http://t.co/StZvpA5'"
1.10526E+17,05/09/2011 01:32,"b'Terminamos la semana con asambleas en Tantoyuca, Tuxpan y Papantla, Ver. Mucho sol y la gente puesta, muy consciente y participativa'"
1.10169E+17,04/09/2011 01:56,"b'Hoy 2 asambleas en la huasteca: Tamazunchale, SLP y Huejutla, Hgo. Se vive la paradoja de que hay agua y buenas tierras pero mucha pobreza'"
1.09812E+17,03/09/2011 02:18,"b'En la ma\xc3\xb1ana me reun\xc3\xad con empresarios en Tampico y por la tarde asambleas en P\xc3\xa1nuco, Ver y Cd Valles, SLP. La preocupaci\xc3\xb3n: la inseguridad'"
1.0946E+17,02/09/2011 02:57,"b'Hoy correspondi\xc3\xb3 al Mante y Tampico, Tamaulipas. La gente sabe que si no hay un cambio de r\xc3\xa9gimen no habr\xc3\xa1 salida a la crisis de bienestar'"
1.09112E+17,01/09/2011 03:54,"b'Hicimos asambleas en San Luis de la Paz, Gto y R\xc3\xado Verde, SLP. Dije que los pri\xc3\xadstas y los panistas de arriba son lo mismo. O no es as\xc3\xad?'"
1.08149E+17,29/08/2011 12:07,"b'Siempre salen con la cantaleta de que no hay presupuesto p\xc3\xbablico. Eso es falso, lo cierto es que se queda arriba http://t.co/075liO1'"
1.08003E+17,29/08/2011 02:28,"b'Recorr\xc3\xad la zona fronteriza de Tamaulipas, hicimos asambleas p\xc3\xbablicas en Reynosa, R\xc3\xado Bravo y Matamoros. La gente no pierde las esperanzas'"
1.07629E+17,28/08/2011 01:41,"b'Hoy fue Linares, NL, y Nuevo Laredo, Tamps. Ante la crisis de violencia, insist\xc3\xad en que debe atenderse a los j\xc3\xb3venes con trabajo y estudio'"
1.07261E+17,27/08/2011 01:19,"b'Llevamos a cabo asamblea en Matehuala, SLP. Di a conocer mi postura sobre la tragedia de Monterrey http://t.co/TudnSPx'"
1.06934E+17,26/08/2011 03:40,"b'Estuve en Tula e Ixmiquilpan, Hidalgo. Estoy triste y lamento la p\xc3\xa9rdida de vidas humanas en Monterrey. Hay consternaci\xc3\xb3n y luto nacional'"
1.06562E+17,25/08/2011 03:02,"b'Particip\xc3\xa9 en la asamblea de Los Cabos, BCS. Habl\xc3\xa9 de c\xc3\xb3mo la crisis econ\xc3\xb3mica y la inseguridad est\xc3\xa1n afectando al turismo y al empleo'"
1.06438E+17,24/08/2011 18:48,"b'Lamento el fallecimiento de Carlota Botey, mujer de principios, luchadora social incansable. Mi m\xc3\xa1s sentido p\xc3\xa9same a familiares y amigos'"
1.05626E+17,22/08/2011 13:03,b'Es indispensable proteger y fomentar a la peque\xc3\xb1a y mediana empresa para reactivar la econom\xc3\xada y crear empleos http://t.co/lsOxYa7'
1.05453E+17,22/08/2011 01:34,"b'Hicimos asambleas en Chilapa y Tlapa, en la monta\xc3\xb1a de Gro. Una de las regiones con m\xc3\xa1s pobreza en el pa\xc3\xads a\xc3\xban cuando son muy trabajadores'"
1.05108E+17,21/08/2011 02:42,"b'Jornada intensa por la costa de Oax y Gro. Asambleas en Pinotepa, Ayutla y Acapulco. Aqu\xc3\xad hubo mucha gente a pesar de la inseguridad'"
1.04747E+17,20/08/2011 02:48,b'Estuvimos en Huajuapan y Tlaxiaco con mixtecos y mixes. La gente est\xc3\xa1 llena de bondad y s\xc3\xb3lo los ha tratado con afecto el Gral C\xc3\xa1rdenas'
1.04378E+17,19/08/2011 02:24,"b'Estuvimos en Ajalpan, Pue y en Huautla, Oax la tierra de Mar\xc3\xada Sabina, en la regi\xc3\xb3n mazateca que vio nacer a los ejemplares Flores Mag\xc3\xb3n'"
1.04246E+17,18/08/2011 17:39,"b'Para evitar malos entendidos, te invito a conocer la carta que envi\xc3\xa9 a los dirigentes del PRD, PT y Convergencia http://t.co/C5drafF'"
1.04021E+17,18/08/2011 02:46,"b'Hicimos asambleas en Cd Serd\xc3\xa1n y Tehuac\xc3\xa1n, Puebla. Al parecer se est\xc3\xa1 aceptando la propuesta de MORENA al PT, PRD y Convergencia'"
1.03096E+17,15/08/2011 13:27,b'Es indispensable reactivar la econom\xc3\xada para generar empleos. Una opci\xc3\xb3n es fomentar la industria de la construcci\xc3\xb3n  http://t.co/80r9is7'
1.02916E+17,15/08/2011 01:33,"b'Terminamos la semana con 3 buenas asambleas en Jiquilpan; Michoac\xc3\xa1n; Cd. Guzm\xc3\xa1n, Jalisco, y Manzanillo, Colima. Me acompa\xc3\xb1\xc3\xb3 el Arq. Peraza'"
1.0257E+17,14/08/2011 02:40,"b'Hoy fue Puru\xc3\xa1ndiro, Zacapu y Zamora, Mich.  Pueblo extraordinario, heredero de los ideales de Morelos, Ocampo, L\xc3\xa1zaro C\xc3\xa1rdenas y M\xc3\xbajica'"
1.02205E+17,13/08/2011 02:30,"b'Las asambleas de hoy fueron en San Francisco del Rinc\xc3\xb3n y Le\xc3\xb3n, Gto. Vamos a proteger a los zapateros de las importaciones sin l\xc3\xadmites'"
1.01878E+17,12/08/2011 04:49,"b'Hay que rescatar al campo del abandono, para producir lo que consumimos y que coman los que nos dan de comer http://t.co/aun8fbZ'"
1.0186E+17,12/08/2011 03:38,"b'Estuvimos en Pabell\xc3\xb3n de Arteaga, Aguascalientes, y Lagos de Moreno, Jalisco. En ambos buena asistencia y aceptaci\xc3\xb3n de nuestras propuestas'"
1.01475E+17,11/08/2011 02:08,"b'Hoy hicimos asambleas en Jerez y Fresnillo, Zacatecas. MORENA est\xc3\xa1 propiciando la unidad desde abajo, de militantes del PRD-PT-Convergencia'"
1.00553E+17,08/08/2011 13:04,"b'No hay salida sin rescatar al campo del abandono. Para ello, no hay m\xc3\xa1s que bienestar y soberan\xc3\xada alimentaria http://bit.ly/nNshZO'"
1.0035E+17,07/08/2011 23:36,"b'Termin\xc3\xb3 la jornada de la semana con asambleas en Acayucan, Cosoleacaque y Minatitl\xc3\xa1n. 12 actos desde el mi\xc3\xa9rcoles por Tlax, Pue, Oax y Ver'"
1.00032E+17,07/08/2011 02:34,"b'Jornada intensa. Con mucho sol en las asambleas de Tuxtepec, Cosamaloapan y San Andr\xc3\xa9s Tuxtla. Pero no es en vano, la gente responde bien'"
9.96737E+16,06/08/2011 02:50,"b'Estuvimos en Zongolica y Orizaba, Veracruz. Impresionante la pobreza en la regi\xc3\xb3n ind\xc3\xadgena mientras arriba sigue el saqueo y la corrupci\xc3\xb3n'"
9.93177E+16,05/08/2011 03:16,"b'Estuvimos en Apizaco, Tlaxcala y Tapeaca, Puebla. Mucha gente no acepta la treta del regreso del PRI a la presidencia. No al gatopardismo'"
9.89277E+16,04/08/2011 01:26,"b'Celebramos asambleas en San Mart\xc3\xadn Texmelucan, Puebla y en Zacatelco, Tlaxcala. Tengamos fe, le volveremos a ganar a la mafia del poder'"
9.80255E+16,01/08/2011 13:41,"b'Se acabar\xc3\xa1 el saqueo y la impunidad en la CFE, pondremos la industria el\xc3\xa9ctrica al servicio del pueblo y de la naci\xc3\xb3n http://bit.ly/oC1jq7'"
9.78716E+16,01/08/2011 03:29,"b'Terminamos la semana con actos en Chapala, Autl\xc3\xa1n y Vallarta. Muchos km. de carretera, pero muy satisfactorio por la actitud de la gente'"
9.74947E+16,31/07/2011 02:32,"b'Hoy 3 asambleas: Tala, Tepatitl\xc3\xa1n y la Barca. Aqu\xc3\xad, contrario a lo que se piensa, el pueblo es progresista y hay campo f\xc3\xa9rtil para MORENA'"
9.71404E+16,30/07/2011 03:04,"b'Por la corrupci\xc3\xb3n y el entreguismo, desde hace 30 a\xc3\xb1os no se construye una nueva refiner\xc3\xada. EU tiene 149, nosotros 6  http://t.co/NIsLUW1'"
9.71304E+16,30/07/2011 02:24,"b'Celebramos asambleas en Ac\xc3\xa1mbaro y Salvatierra, Gto. Mucha pobreza, abandono e inseguridad, por culpa de los jefes del PRIAN y sus secuaces'"
9.6774E+16,29/07/2011 02:48,"b'Hicimos buenas asambleas en San Miguel de Allende y Celaya, Guanajuato. La gente est\xc3\xa1 despertando, a pesar del enga\xc3\xb1o y la manipulaci\xc3\xb3n'"
9.64128E+16,28/07/2011 02:53,"b'Estuve en Ezequiel Montes y San Juan del R\xc3\xado, Qro. Ayer Fox confes\xc3\xb3 que su candidato es Pe\xc3\xb1a. No hay diferencia, es una sola mafia de poder'"
9.54809E+16,25/07/2011 13:10,b'Al triunfo de MORENA construiremos 5 refiner\xc3\xadas para dejar de importar 400 mil barriles diarios de gasolinas y diesel http://bit.ly/rtazxj'
9.53341E+16,25/07/2011 03:26,"b'Celebramos  actos en L\xc3\xa1zaro C\xc3\xa1rdenas, Apatzing\xc3\xa1n y Uruapan. Habl\xc3\xa9 de apoyar la alianza PRD, PT convergencia en las elecciones de Michoac\xc3\xa1n'"
9.49742E+16,24/07/2011 03:36,"b'Jornada intensa pero muy satisfactoria. Hicimos 3 concurridas asambleas en Iguala, Altamirano y Zihuatanejo. La gente est\xc3\xa1 por el cambio'"
9.45992E+16,23/07/2011 02:46,"b'Actos en Jiutepec y Jojutla. La gente muy cari\xc3\xb1osa, un compa\xc3\xb1ero dijo: ""nosotros tenemos el poder del amor, ellos s\xc3\xb3lo el amor al poder""'"
9.42377E+16,22/07/2011 02:50,"b'Hicimos dos grandes asambleas en Yautepec y Cuautla, Mor. Record\xc3\xa9 a Emiliano Zapata y su ejemplar lucha por la libertad y  la justicia'"
9.38743E+16,21/07/2011 02:46,b'Terminamos la asamblea en Ciudad J\xc3\xbaarez. Lamentablemente hay desolaci\xc3\xb3n y temor pero la gente particip\xc3\xb3 y tiene la esperanza de un cambio'
9.29374E+16,18/07/2011 12:42,b'A partir de ahora hablaremos m\xc3\xa1s sobre los proyectos de desarrollo que proponemos para transformar a M\xc3\xa9xico http://bit.ly/p9silx'
9.28317E+16,18/07/2011 05:43,"b'Terminamos la jornada de hoy que incluy\xc3\xb3 asambleas en San Luis R\xc3\xado Colorado, Mexicali y Ensenada. Particip\xc3\xb3 mucha gente de la clase media'"
9.24279E+16,17/07/2011 02:58,"b'Al mediod\xc3\xada celebramos la asamblea en Guaymas y estamos terminando la de Nogales. Ma\xc3\xb1ana San Luis R\xc3\xado Colorado, Mexicali y Ensenada'"
9.2088E+16,16/07/2011 04:27,"b'Visitamos Navojoa y Cajeme, Son. Hay mucha gente dispuesta a luchar por la transformaci\xc3\xb3n del pa\xc3\xads, no todos est\xc3\xa1n anestesiados con la TV'"
9.17127E+16,15/07/2011 03:36,"b'Estuvimos en El Fuerte y Los Mochis, Sinaloa. Est\xc3\xa1n participando integrantes de clases medias. Transformar a M\xc3\xa9xico es asunto de todos'"
9.14839E+16,14/07/2011 12:27,"b'Aunque no coincidamos, MORENA es la \xc3\xbanica opci\xc3\xb3n para frenar la decadencia y lograr la transformaci\xc3\xb3n de M\xc3\xa9xico http://bit.ly/oOTg03'"
9.13346E+16,14/07/2011 02:34,"b'Hicimos 2 buenas asambleas en Iz\xc3\xbacar y Atlixco, Puebla. Por la simulaci\xc3\xb3n que hay, dije: sali\xc3\xb3 el gober precioso y entr\xc3\xb3 el gober mafioso'"
9.06016E+16,12/07/2011 02:01,"b'Mi profundo pesar por el fallecimiento de Francisco Goitia, sacerdote jesuita, defensor de los derechos humanos y cristiano de verdad'"
9.04178E+16,11/07/2011 13:51,b'Consolidemos MORENA. Es la \xc3\xbanica opci\xc3\xb3n para transformar a M\xc3\xa9xico. Participa como protagonista del cambio verdadero http://bit.ly/oOTg03'
9.02412E+16,11/07/2011 02:09,"b'Estuvimos en Izamal, Valladolid y Playa del Carmen. Terminamos el recorrido por el sureste: Tabasco, Campeche, Yucat\xc3\xa1n y Quintana Roo'"
8.98994E+16,10/07/2011 03:31,"b'Todo apunta que la gira que hemos iniciado esta semana, aunque es en regiones, va a estar como la que puedes ver aqu\xc3\xad http://bit.ly/mClISH'"
8.98711E+16,10/07/2011 01:38,"b'A pesar de la lluvia celebramos la asamblea de Tekax, Yuc. La gente asisti\xc3\xb3 y se comprometi\xc3\xb3 a seguir luchando por el cambio verdadero'"
8.97936E+16,09/07/2011 20:30,"b'Terminamos acto de Chetumal vamos a Tekax, Yuc. Nos enteramos del fallecimiento de Adolfo S\xc3\xa1nchez V\xc3\xa1zquez fil\xc3\xb3sofo y humanista del mundo'"
8.95107E+16,09/07/2011 01:46,"b'Tuvimos una muy buena asamblea en Ciudad del Carmen, Campeche. La gente est\xc3\xa1 entusiasmada y quiere el cambio verdadero. Ma\xc3\xb1ana Chetumal'"
8.9155E+16,08/07/2011 02:13,b'Estuvimos en Comalcalco y Para\xc3\xadso. Dije que vamos a procesar todo el petr\xc3\xb3leo crudo en nuestro pa\xc3\xads y agregaremos valor a la materia prima'
8.87972E+16,07/07/2011 02:31,b'El primero de octubre en la ciudad de M\xc3\xa9xico vamos a celebrar la Asamblea Constitutiva del Movimiento Regeneraci\xc3\xb3n Nacional MORENA'
8.87961E+16,07/07/2011 02:26,b'Estuve en Macuspana y C\xc3\xa1rdenas. Inicio en Tabasco una gira por todas las regiones del pa\xc3\xads que terminar\xc3\xa1 el 30 de septiembre en Guelatao'
8.78704E+16,04/07/2011 13:08,b'Te invito a ver las asambleas de MORENA en los estados. Lo que no se difunde en Televisa por la censura que padecemos http://bit.ly/mClISH'
8.69866E+16,02/07/2011 02:36,b'Hicieron fraude en 2006 para mantener la corrupci\xc3\xb3n y ahora la realidad est\xc3\xa1 sacando a flote la inmundicia que ni sus voceros pueden tapar'
8.6618E+16,01/07/2011 02:11,b'Las confesiones de Fox de que carg\xc3\xb3 los dados y ahora las de Elba Esther no dejan duda del fraude del 2006 y del da\xc3\xb1o causado a M\xc3\xa9xico'
8.62645E+16,30/06/2011 02:47,b'Estuve con Jes\xc3\xbas Gonz\xc3\xa1lez Schmal en Piedras Negras Coah. Aqu\xc3\xad el del PAN ofrece 1000 pesos x voto y el del PRI 5000. Eso es la democracia?'
8.5907E+16,29/06/2011 03:06,"b'Acompa\xc3\xb1e a Jes\xc3\xbas Gonz\xc3\xa1lez Schmal a San Pedro de las Colonias, Coah. All\xc3\xad Madero se rebel\xc3\xb3 contra el porfiriato. Hoy andamos en lo mismo'"
8.53405E+16,27/06/2011 13:35,b'Ayer acompa\xc3\xb1amos a Alejandro Encinas en los cierres de campa\xc3\xb1a en Neza y Tultepec. Es un extraordinario candidato http://bit.ly/l8N0om'
8.51562E+16,27/06/2011 01:23,b'Estuve con Alejandro Encinas. El 3 de julio la contienda ser\xc3\xa1 entre la mafia del poder con su dinero y sus voceros vs el decoro del pueblo'
8.48222E+16,26/06/2011 03:16,"b'Terminamos la gira de 3 d\xc3\xadas por Nayarit. Hoy hicimos Ahuacatlan, Compostela y Bah\xc3\xada de Banderas. Ma\xc3\xb1ana a Neza con Alejandro Encinas'"
8.44512E+16,25/06/2011 02:41,b'Estuvimos en Santiago y San Blas con Nayar candidato a gobernador de Nayarit. La gente quiere el cambio pero el PRIAN esta comprando votos'
8.40993E+16,24/06/2011 03:23,"b'Hoy hicimos actos en Tecuala y Tuxpan, Nayarit en apoyo a Nayar Mayorquin, candidato a gobernador. Nayar es distinto: es gente honesta'"
8.28067E+16,20/06/2011 13:47,b'La concentraci\xc3\xb3n desmedida de dinero y poder quebr\xc3\xb3 el pacto social y desat\xc3\xb3 la crisis. Hace falta un nuevo pacto  http://bit.ly/myZick'
8.19206E+16,18/06/2011 03:06,b'Si se hubiese respetado el voto en el 2006 M\xc3\xa9xico no estar\xc3\xada en la situaci\xc3\xb3n tan lamentable en que se encuentra http://bit.ly/hVwsM3'
8.15506E+16,17/06/2011 02:35,b'Con un poco de luz en la frente  qui\xc3\xa9n puede negar que M\xc3\xa9xico est\xc3\xa1 a merced de una mafia de cuello blanco. La salida es una transformaci\xc3\xb3n'
8.11706E+16,16/06/2011 01:25,"b'La tragedia actual se comprender\xc3\xada mejor si se supiera que en 28 a\xc3\xb1os el crecimiento suma 0 + desigualdad, corrupci\xc3\xb3n y p\xc3\xa9rdida de valores'"
8.02629E+16,13/06/2011 13:19,"b'Buena la asamblea de ayer en Los \xc3\x81ngeles. Muchos paisanos conf\xc3\xadan en nosotros, saben que el cambio los proteger\xc3\xa1 http://bit.ly/l14aBt'"
7.95805E+16,11/06/2011 16:07,"b'Paisanos: ma\xc3\xb1ana a las 11 hrs vamos a llevar a cabo una asamblea informativa frente a la alcald\xc3\xada de Los \xc3\x81ngeles, California. Te invito'"
7.89998E+16,10/06/2011 01:39,b'Un periodista salinista dijo que soy cliente de la exclusiva tienda Bijan. Falso. Ah\xc3\xad compra Pe\xc3\xb1a N. No somos iguales. Tengo principios'
7.77256E+16,06/06/2011 13:16,b'Ayer en el Z\xc3\xb3calo se refrend\xc3\xb3 el compromiso de muchos de seguir luchando por la salvaci\xc3\xb3n de M\xc3\xa9xico. Gracias http://bit.ly/kwq7mj'
7.72102E+16,05/06/2011 03:08,"b'Plaza llena en Oaxaca. Adem\xc3\xa1s de ser uno de los pueblos con m\xc3\xa1s cultura en el mundo, tiene un gran esp\xc3\xadritu de lucha. Ma\xc3\xb1ana al Z\xc3\xb3calo'"
7.68439E+16,04/06/2011 02:53,"b'Terminamos la asamblea de Chihuahua. Lleg\xc3\xb3 gente de todos los municipios, de Morelos que est\xc3\xa1 a 12 hrs y de J\xc3\xbaarez, a pesar de los pesares'"
7.64991E+16,03/06/2011 04:03,"b'Estoy en La Paz, BCS en donde celebramos una asamblea con integrantes de MORENA de todo el estado. Llegaron hasta de Guerrero Negro'"
7.61383E+16,02/06/2011 04:09,"b'Estoy de regreso al DF. Visit\xc3\xa9 Poza Rica para reunirme con ciudadanos de MORENA del norte de Veracruz. Vamos muy bien. Ma\xc3\xb1ana La Paz, BCS'"
7.52115E+16,30/05/2011 14:46,b'Vamos al Z\xc3\xb3calo este domingo 5 de junio a las 10 horas. Te invito a participar en la asamblea nacional de MORENA http://bit.ly/lQ9rKC'
7.50574E+16,30/05/2011 04:34,b'Hicimos asambleas en Durango y Torre\xc3\xb3n con las plazas llenas. Terminamos muy bien una semana m\xc3\xa1s de la gira Salvemos a M\xc3\xa9xico'
7.46747E+16,29/05/2011 03:13,b'Estuve en Culiac\xc3\xa1n y Tepic. Habl\xc3\xa9 de la urgente necesidad del cambio e insist\xc3\xad en que la paz y la tranquilidad son frutos de la justicia'
7.43147E+16,28/05/2011 03:22,"b'Terminamos la asamblea en Hermosillo, Son. Particip\xc3\xb3 gente hasta de los municipios m\xc3\xa1s lejanos: Cananea, Bacanora, San Luis R\xc3\xado Colorado..'"
7.39991E+16,27/05/2011 06:28,"b'Termin\xc3\xb3 la cena con empresarios de Baja California. Al igual que la asamblea p\xc3\xbablica de la tarde, fue muy participativa. Hay mucho inter\xc3\xa9s'"
7.35611E+16,26/05/2011 01:28,"b'Terminamos la asamblea de Jalapa, Ver. Mucha gente consciente y decidida a participar en la transformaci\xc3\xb3n del pa\xc3\xads. Ma\xc3\xb1ana Tijuana'"
7.26507E+16,23/05/2011 13:10,b'Comenz\xc3\xb3 la campa\xc3\xb1a en el Edo Mex. Encinas es un extraordinario candidato y se le puede ganar a la mafia del poder http://bit.ly/lEbhdm'
7.24837E+16,23/05/2011 02:07,"b'Hoy 2 buenas asambleas en Saltillo y Monterrey. A pesar del miedo y el temor que prevalece, la gente participa y ve en el cambio la salida'"
7.21081E+16,22/05/2011 01:14,"b'Estuve en el Heroico Puerto de Veracruz. A diferencia de otras veces, la gente se manifest\xc3\xb3 abiertamente a favor de un cambio verdadero'"
7.17545E+16,21/05/2011 01:49,"b'Asamblea en Coatzacoalcos, Veracruz. Cada vez est\xc3\xa1 peor la situaci\xc3\xb3n econ\xc3\xb3mica de la gente, hay mucha pobreza. Duele esta amarga realidad'"
7.14289E+16,20/05/2011 04:15,"b'Mucha gente en Juchit\xc3\xa1n. Expliqu\xc3\xa9 el proyecto de desarrollo del Istmo, el c\xc3\xb3mo aprovechar la ventaja de unir al Pac\xc3\xadfico con el Atl\xc3\xa1ntico'"
7.10522E+16,19/05/2011 03:18,b'Celebramos una asamblea en la plaza principal de Colima. Mucha gente y entusiasmo por participar en el rescate del pa\xc3\xads. Ma\xc3\xb1ana Juchit\xc3\xa1n'
7.01178E+16,16/05/2011 13:26,"b'Tres semanas de gira nacional. 19 buenos actos. A pesar de los pesares, muchos no han ca\xc3\xaddo en la desesperanza http://bit.ly/lYldKg'"
6.99474E+16,16/05/2011 02:08,b'Hicimos dos muy buenas asambleas en Guanajuato y Quer\xc3\xa9taro. Es satisfactorio constatar que mucha gente no a perdido la fe y sigue luchando'
6.95913E+16,15/05/2011 02:33,b'Estuve en Cd Victoria y San Luis Potos\xc3\xad. Propuse enfrentar la inseguridad garantizando estudio y empleo a los j\xc3\xb3venes. Y dije c\xc3\xb3mo hacerlo'
6.92216E+16,14/05/2011 02:04,b'Espl\xc3\xa9ndida asamblea en Guadalajara. Advert\xc3\xad sobre el nuevo enga\xc3\xb1o de que el PAN no sirve y la opci\xc3\xb3n es que regrese el PRI. Son iguales'
6.88768E+16,13/05/2011 03:14,b'Muy buena asamblea en Aguascalientes. Ya hay un despertar ciudadano. Tengamos fe: el pueblo terminar\xc3\xa1 por convencerse en favor del cambio'
6.85036E+16,12/05/2011 02:31,"b'Buena asamblea en la principal plaza p\xc3\xbablica de Zacatecas. Hubo mucha gente y hablaron los l\xc3\xadderes del PRD, PT y Convergencia. Hay unidad'"
6.75761E+16,09/05/2011 13:06,b'La semana pasada celebramos seis asambleas en el sureste. Estuve en mi tierra y en mi agua. Te comparto un fragmento http://bit.ly/iNwRcu'
6.74034E+16,09/05/2011 01:40,b'Hicimos asambleas en M\xc3\xa9rida y Canc\xc3\xban. Tambi\xc3\xa9n con las plazas llenas. Terminamos muy bien la segunda semana de la gira Salvemos a M\xc3\xa9xico'
6.70521E+16,08/05/2011 02:24,b'Buena asamblea de MORENA en Campeche. Ya se constituyeron los 488 comit\xc3\xa9s seccionales en los 11 municipios. Se consolida la organizaci\xc3\xb3n'
6.6696E+16,07/05/2011 02:49,"b'Hoy asamblea de MORENA en Villahermosa. Mucho entusiasmo y mucha gente, como en los buenos tiempos. Mis paisanos no pierden la esperanza'"
6.63339E+16,06/05/2011 02:50,"b'Estuve en Tuxtla Guti\xc3\xa9rrez. Mucha gente. Ma\xc3\xb1ana asamblea en Villahermosa, a las 6 pm en la plaza de la Revoluci\xc3\xb3n. En mi tierra, en mi agua'"
6.59564E+16,05/05/2011 01:50,b'Inici\xc3\xa9 una gira por el sureste. Estuve en la plaza principal de Tapachula. El llamado es a terminar de organizarnos para salvar a M\xc3\xa9xico'
6.50406E+16,02/05/2011 13:11,b'Ayer terminamos la 1a semana de la gira Salvemos a M\xc3\xa9xico. Vamos a cerrar en el Z\xc3\xb3calo el 5 de junio a las 10 hrs http://bit.ly/ju3iAA'
6.48664E+16,02/05/2011 01:38,"b'Hicimos asambleas en Chilpancingo, Guerrero y Cuernavaca, Morelos. De jueves a domingo fueron 7 con mucha gente en las plazas p\xc3\xbablicas'"
6.44988E+16,01/05/2011 01:18,b'Hoy hicimos asambleas en plazas publicas en Puebla y Tlaxcala. Ma\xc3\xb1ana en Chilpancingo y Cuernavaca. Va bien la gira Salvemos a M\xc3\xa9xico'
6.41398E+16,30/04/2011 01:31,"b'Particip\xc3\xa9 en la asamblea de MORENA en Pachuca, Hidalgo. Asistieron muchos ciudadanos y hay bastante entusiasmo. Ma\xc3\xb1ana Puebla y Tlaxcala'"
6.3778E+16,29/04/2011 01:33,b'Hoy iniciamos en Morelia la gira nacional Salvemos a M\xc3\xa9xico. Te invito a leer mi discurso                       (cont) http://tl.gd/a53an7'
6.24948E+16,25/04/2011 12:35,b'En esta semana comenzamos una gira por todo el pa\xc3\xads. Vamos a convocar al pueblo para regenerar la vida p\xc3\xbablica http://bit.ly/gahjJl'
5.99662E+16,18/04/2011 13:07,"b'No basta con mejorar las condiciones materiales del pueblo, hace falta tambi\xc3\xa9n fortalecer valores espirituales http://bit.ly/dV8pIm'"
5.981E+16,18/04/2011 02:46,"b'Hoy estuvimos en Chicoloapan, Teotihuac\xc3\xa1n, Zumpango y Teoloyucan; concluimos la tercera gira por el Edomex. La evaluaci\xc3\xb3n es muy buena'"
5.9461E+16,17/04/2011 03:39,b'Hoy celebramos asambleas informativas en 4 zonas de ciudad Nezahualc\xc3\xb3yotl. La gente est\xc3\xa1 entusiasmada. En las dos \xc3\xbaltimas llov\xc3\xada a c\xc3\xa1ntaros'
5.90862E+16,16/04/2011 02:50,b'Hicimos asambleas en Huixquilucan y Jilotepec. Envi\xc3\xa9 una carta a Televisa-Carlos Salinas que puedes ver en la p\xc3\xa1gina del Gobierno Leg\xc3\xadtimo'
5.87445E+16,15/04/2011 04:12,b'Por la ma\xc3\xb1ana estuvimos en el Congreso y por la tarde en Tlalnepantla y Cuautitl\xc3\xa1n Izcalli. Hay mucho entusiasmo y participaci\xc3\xb3n ciudadana'
5.86831E+16,15/04/2011 00:08,b'Te invito a ver este discurso sobre el nuevo Proyecto de Naci\xc3\xb3n y las 50 medidas para transformar a M\xc3\xa9xico http://bit.ly/dSfPsi'
5.83498E+16,14/04/2011 02:04,"b'Hoy estuvimos en Naucalpan y Nicol\xc3\xa1s Romero, Edomex. Dos buenas asambleas informativas. Ma\xc3\xb1ana nos vemos en San L\xc3\xa1zaro, a las 11am. Asiste'"
5.74198E+16,11/04/2011 12:28,b'Participa el jueves a las 11 hrs en el mitin frente a la C\xc3\xa1mara de Diputados. No a la reforma laboral del PRIAN http://bit.ly/fxM7i6'
5.72454E+16,11/04/2011 00:55,b'Ma\xc3\xb1ana a las 8 hrs voy a una entrevista con Carlos Puig en W radio. En TV estamos vetados. En radio hay pocos espacios abiertos y vamos'
5.72378E+16,11/04/2011 00:25,"b'Estuve en Tejupilco, Valle de Bravo y Tenancingo. En las 3 asambleas se celebr\xc3\xb3 la no alianza con el PAN. Vamos a ganar con la izquierda'"
5.69026E+16,10/04/2011 02:13,b'Hoy 3 asambleas en distintos lugares de Ecatepec. Mucho entusiasmo y el compromiso de apoyar al candidato de Morena: Alejandro Encinas'
5.65385E+16,09/04/2011 02:06,b'Hoy estuve en Metepec y Toluca en asambleas informativas. Cada vez se acercan m\xc3\xa1s militantes del PRI y del PAN para sumarse a MORENA'
5.61721E+16,08/04/2011 01:50,b'Nos reunimos con protagonistas del cambio verdadero en Naucalpan y Tlalnepantla. Por la ma\xc3\xb1ana en la C\xc3\xa1mara trat\xc3\xa9 lo de la reforma laboral'
5.58226E+16,07/04/2011 02:42,"b'Estuve en asambleas en Coacalco, Cuautitl\xc3\xa1n y Tultitl\xc3\xa1n.  Ma\xc3\xb1ana a las 10 hrs voy al Congreso al asunto de la reforma a la Ley del Trabajo'"
5.48923E+16,04/04/2011 13:05,"b'La reforma a la Ley Federal del Trabajo, propuesta por el PRI y apoyada por Calder\xc3\xb3n, es un retroceso inaceptable http://bit.ly/hdDYHp'"
5.47182E+16,04/04/2011 01:33,"b'Estuve en Atlacomulco, Ixtlahuaca, Toluca y Zinacantepec. En los dos \xc3\xbaltimos acompa\xc3\xb1ado de Alejandro Encinas, nuestro candidato al Edo M\xc3\xa9x'"
5.43895E+16,03/04/2011 03:47,"b'Hoy fue Valle de Chalco, Chalco e Ixtapaluca. Estoy informando sobre la nociva reforma a la Ley Federal del Trabajo propuesta por el PRIAN'"
5.40246E+16,02/04/2011 03:37,"b'Estuve en Texcoco y Chimalhuac\xc3\xa1n. Ante el control de los medios que ejerce la mafia del poder, hemos optado por informar pueblo por pueblo'"
5.36907E+16,01/04/2011 05:30,"b'Aunque muchos no quieran reconocerlo, nosotros seguimos insistiendo que el PRI y el PAN son lo mismo. Pruebas\xe2\x80\xa6 http://bit.ly/eLimTr'"
5.36452E+16,01/04/2011 02:29,b'Hoy dos asambleas en Naucalpan y Atizap\xc3\xa1n. Cada vez hay m\xc3\xa1s gente y ahora se agrega el entusiasmo por la candidatura de Alejandro Encinas'
5.32882E+16,31/03/2011 02:51,b'Comenzamos una nueva gira por el Edo Mex. Estuvimos en Ecatepec-Tlanepantla con protagonistas del cambio verdadero y con comit\xc3\xa9s de MORENA'
5.23701E+16,28/03/2011 14:03,b'Hay quienes por conveniencia \xc3\xb3 desorientaci\xc3\xb3n creen que el PRI y el PAN son distintos. La realidad dice lo contrario http://bit.ly/eLimTr'
5.20863E+16,27/03/2011 19:15,"b'Como lo hicimos con los cooperativistas, firmamos compromisos con el Movimiento Social por un Gobierno del Pueblo. S\xc3\xad a estas alianzas'"
5.14102E+16,25/03/2011 22:28,"b'Estuve en la constituci\xc3\xb3n del Consejo de Encuentro en Morelos. Hay intelectuales, empresarios y l\xc3\xadderes sociales; pluralidad y entusiasmo'"
