id,created_at,text
1.03268E+18,23/08/2018 17:13,"b'Me escap\xc3\xa9, un ratito, para practicar beisbol https://t.co/LAGlfxlBl7'"
1.03245E+18,23/08/2018 02:06,b'Me reun\xc3\xad con el general de divisi\xc3\xb3n Salvador Cienfuegos; me dio sus puntos de vista sobre el grave problema de la v\xe2\x80\xa6 https://t.co/5oPGZy4NeL'
1.03168E+18,20/08/2018 22:53,b'Hoy inici\xc3\xb3 la transici\xc3\xb3n institucional https://t.co/yojCnS4DWx'
1.03156E+18,20/08/2018 14:55,"b'Asist\xc3\xad al Congreso de Morena, me desped\xc3\xad con nostalgia. Record\xc3\xa9 un fragmento de la canci\xc3\xb3n de Silvio: \xc2\xabQuien ayer m\xe2\x80\xa6 https://t.co/YQV8yTDqCT'"
1.03092E+18,18/08/2018 21:06,b'Un poem\xc3\xadnimo de Ernesto Cardenal que recitaba: \xc2\xabMe contaron que / estabas enamorada de otro / Y entonces me / fui a\xe2\x80\xa6 https://t.co/LmGyollBAo'
1.0306E+18,17/08/2018 23:31,"b'Hoy convers\xc3\xa9 con Tar\xc5\x8d K\xc5\x8dno, canciller de Jap\xc3\xb3n. Tratamos asuntos de cooperaci\xc3\xb3n econ\xc3\xb3mica, comercio, protecci\xc3\xb3n civ\xe2\x80\xa6 https://t.co/ppMDtIUhaS'"
1.02976E+18,15/08/2018 16:14,b'Celebro el encuentro con los senadores y me llena de gusto que hayan tomado la decisi\xc3\xb3n de proponer una reducci\xc3\xb3n d\xe2\x80\xa6 https://t.co/z86t2UQ3Yl'
1.02945E+18,14/08/2018 19:47,"b'No hay que pensarlo mucho. El programa deportivo 2018-2024 tendr\xc3\xa1 tres vertientes: actividad f\xc3\xadsica y deportiva, en\xe2\x80\xa6 https://t.co/vfxK3v4NsS'"
1.02918E+18,14/08/2018 01:51,"b'Hoy tomamos la decisi\xc3\xb3n de construir el Tren Maya, incluyendo Chiapas, Tabasco, Campeche, Yucat\xc3\xa1n y Quintana Roo, d\xe2\x80\xa6 https://t.co/JqMu8sFgI1'"
1.02873E+18,12/08/2018 19:40,"b'Convers\xc3\xa9 con Ricardo Monreal, senador electo y probable dirigente de nuestro movimiento en esa C\xc3\xa1mara del Poder Leg\xe2\x80\xa6 https://t.co/7oalDwieOP'"
1.02835E+18,11/08/2018 18:51,b'Me reun\xc3\xad con delegados estatales y regionales del pr\xc3\xb3ximo gobierno democr\xc3\xa1tico https://t.co/oVkKLfbGe9'
1.02797E+18,10/08/2018 17:32,"b'En una actitud de respeto y bajo el principio de la separaci\xc3\xb3n y el equilibrio de poderes, como corresponde a un au\xe2\x80\xa6 https://t.co/vDkjbeLIgD'"
1.02775E+18,10/08/2018 02:47,"b'Hoy me reun\xc3\xad con el Presidente Enrique Pe\xc3\xb1a para tratar, entre otras cosas, lo relativo a la creaci\xc3\xb3n de la Secreta\xe2\x80\xa6 https://t.co/oJVNXOYpoL'"
1.02729E+18,08/08/2018 20:16,b'Les comparto el discurso que pronunci\xc3\xa9 en la Sesi\xc3\xb3n solemne de entrega de la constancia como Presidente Electo de l\xe2\x80\xa6 https://t.co/o51Yg1u6Sy'
1.02725E+18,08/08/2018 18:01,b'Sesi\xc3\xb3n solemne de entrega de constancia de Presidente electo en el Tribunal Electoral del Poder Judicial https://t.co/sgNnjWpPUw'
1.02687E+18,07/08/2018 16:34,"b""Estamos en la inauguraci\xc3\xb3n del 'Foro Escucha', en Ciudad Ju\xc3\xa1rez, para lograr la paz y reconciliaci\xc3\xb3n en M\xc3\xa9xico https://t.co/cWPrH0hbZd"""
1.02654E+18,06/08/2018 18:44,"b'Nunca olvidar\xc3\xa9 el apoyo de artistas, actores y promotores de cultura que nos acompa\xc3\xb1aron hasta en los momentos m\xc3\xa1s\xe2\x80\xa6 https://t.co/VAGTtTKHHq'"
1.02585E+18,04/08/2018 21:00,"b'Continuamos con el trabajo de campo para iniciar, desde el 1 de diciembre, el programa de siembra de un mill\xc3\xb3n de h\xe2\x80\xa6 https://t.co/erWRrybggQ'"
1.0254E+18,03/08/2018 15:17,"b'El 1 de julio por la noche me habl\xc3\xb3 por tel\xc3\xa9fono para reconocer nuestro triunfo, Jos\xc3\xa9 Antonio Meade. En ese entonce\xe2\x80\xa6 https://t.co/DfOZilojKv'"
1.02509E+18,02/08/2018 18:30,"b'Seremos fieles a nuestra tradici\xc3\xb3n de pol\xc3\xadtica exterior fincada en el respeto, la amistad, la paz y la cooperaci\xc3\xb3n\xe2\x80\xa6 https://t.co/4H9xMyCYRe'"
1.02476E+18,01/08/2018 20:42,"b'Hace un mes, m\xc3\xa1s de 30 millones de mexicanos, nos dieron su confianza. Ni a ellos ni a nadie les fallaremos.\nHoy co\xe2\x80\xa6 https://t.co/cbXQquY4N7'"
1.02441E+18,31/07/2018 21:51,"b'Reitero: se dar\xc3\xa1 prioridad a la medicina preventiva, se acabar\xc3\xa1 con la corrupci\xc3\xb3n en la compra de medicamentos, se\xe2\x80\xa6 https://t.co/c6vJmgheN5'"
1.02374E+18,30/07/2018 01:33,b'Hoy hicimos trabajo de campo para terminar de redondear el proyecto de la siembra de 1 mill\xc3\xb3n de hect\xc3\xa1reas de \xc3\xa1rbol\xe2\x80\xa6 https://t.co/Ur5758jxtC'
1.02296E+18,27/07/2018 21:26,"b'Voy camino a la Selva Lacandona pero no pude resistirme y pas\xc3\xa9 a comer frijol con puerco en la fonda ""La popular"",\xe2\x80\xa6 https://t.co/xEU97E6Kuy'"
1.02225E+18,25/07/2018 22:32,b'Hemos recibido un trato muy gentil del primer ministro Trudeau. Me expres\xc3\xb3 su benepl\xc3\xa1cito y ha enviado a una delega\xe2\x80\xa6 https://t.co/bP10wgg8cj'
1.02191E+18,25/07/2018 00:19,b'Les comparto la carta de respuesta que nos envi\xc3\xb3 amablemente el presidente Donald Trump: https://t.co/YauqZ43owL https://t.co/LO0VxP6KGN'
1.0211E+18,22/07/2018 18:43,b'Les comparto el contenido de la carta que enviamos en d\xc3\xadas pasados al presidente Donald Trump \nhttps://t.co/xSSNaxgiFp'
1.02084E+18,22/07/2018 01:10,b'Todav\xc3\xada hoy sali\xc3\xb3 informaci\xc3\xb3n del INE diciendo que no encontraban mi donaci\xc3\xb3n a los damnificados en el fideicomiso\xe2\x80\xa6 https://t.co/E1ZJbA5YXW'
1.02047E+18,21/07/2018 00:55,b'Un mensaje sobre la multa injusta e ilegal a MORENA por parte del INE\n\nhttps://t.co/M7P1EuVAmy'
1.01999E+18,19/07/2018 17:10,b'La multa impuesta por INE a Morena por 197 mdp es una vil venganza. No existe ning\xc3\xban acto inmoral con el fideicomis\xe2\x80\xa6 https://t.co/CI8NZU6AnN'
1.0196E+18,18/07/2018 15:21,"b'Efem\xc3\xa9rides de gigantes: hoy se cumplen 146 a\xc3\xb1os de la muerte de Benito Ju\xc3\xa1rez, y es el centenario del nacimiento de\xe2\x80\xa6 https://t.co/8KMRAvBTLW'"
1.01861E+18,15/07/2018 21:42,b'En conferencia de prensa dimos a conocer los lineamientos generales para el combate a la corrupci\xc3\xb3n y la aplicaci\xc3\xb3n\xe2\x80\xa6 https://t.co/FeXk84Wb6H'
1.01787E+18,13/07/2018 20:34,"b'Recibimos a la comisi\xc3\xb3n que envi\xc3\xb3 el presidente Donald Trump integrada por Mike Pompeo, secretario de Estado; Steve\xe2\x80\xa6 https://t.co/gRByDWGqfF'"
1.01764E+18,13/07/2018 05:27,b'Conferencia de prensa despu\xc3\xa9s de la reuni\xc3\xb3n con integrantes de la Conferencia Nacional de Gobernadores\xe2\x80\xa6 https://t.co/kDDkxbTyfW'
1.01762E+18,13/07/2018 03:57,b'Conferencia de prensa despu\xc3\xa9s de la reuni\xc3\xb3n con integrantes de la Conferencia Nacional de Gobernadores https://t.co/urTikFeHjX'
1.01722E+18,12/07/2018 01:22,"b'Platiqu\xc3\xa9 con Elenita Poniatowska y me reun\xc3\xad con diputados federales, senadores, gobernadores, presidentes municipal\xe2\x80\xa6 https://t.co/62vqkZONpY'"
1.01683E+18,10/07/2018 23:37,b'Hoy informamos sobre el encuentro que llevaremos a cabo el viernes con la delegaci\xc3\xb3n del gobierno estadounidense qu\xe2\x80\xa6 https://t.co/VwQcqnIzzG'
1.01646E+18,09/07/2018 23:31,b'Hoy celebramos 4 a\xc3\xb1os del registro de MORENA como partido pol\xc3\xadtico. Dejo a cada quien que haga sus propias reflexio\xe2\x80\xa6 https://t.co/Om1yrI0dn8'
1.01561E+18,07/07/2018 14:54,"b'Me entrevist\xc3\xa9 con Enrique Graue Wiechers, rector de la Universidad Nacional Aut\xc3\xb3noma de M\xc3\xa9xico, nuestra alma m\xc3\xa1ter. https://t.co/nyFTqDijRY'"
1.01541E+18,07/07/2018 01:57,"b'Por la ma\xc3\xb1ana nos reunimos con los  integrantes del pr\xc3\xb3ximo Gabinete de Pol\xc3\xadtica Interna, Exterior y Seguridad; por\xe2\x80\xa6 https://t.co/fQSFIX6Wwr'"
1.01459E+18,04/07/2018 19:06,"b'En un ambiente de confianza mutua  y de unidad para impulsar el desarrollo de M\xc3\xa9xico, sostuvimos una aut\xc3\xa9ntica reun\xe2\x80\xa6 https://t.co/rxTypK9qy2'"
1.01426E+18,03/07/2018 21:14,"b'Me reun\xc3\xad con el ingeniero Cuauht\xc3\xa9moc C\xc3\xa1rdenas Sol\xc3\xb3rzano, precursor, junto con otros dirigentes respetables vivos y\xe2\x80\xa6 https://t.co/EWF8YWAh0R'"
1.01385E+18,02/07/2018 18:29,b'Recib\xc3\xad llamada de Donald Trump y conversamos durante media hora. Le propuse explorar un acuerdo integral; de proyec\xe2\x80\xa6 https://t.co/6tePDAgOdS'
1.01368E+18,02/07/2018 07:19,b'Primer mensaje 01 de julio 2018 #Andr\xc3\xa9sManuelPresidente https://t.co/ji9E9Mfae2'
1.01367E+18,02/07/2018 06:22,b'Mensaje desde el Z\xc3\xb3calo de la Ciudad de M\xc3\xa9xico #Andr\xc3\xa9sManuelPresidente https://t.co/6hR241RJBL'
1.01366E+18,02/07/2018 05:36,b'No les voy a fallar https://t.co/ABtjyauaoR'
1.01364E+18,02/07/2018 04:16,b'Mensaje en vivo #Andr\xc3\xa9sManuelPresidente \n\nhttps://t.co/fZixbdrWLA'
1.01211E+18,27/06/2018 23:08,b'Acomp\xc3\xa1\xc3\xb1anos en vivo desde el Estadio Azteca. \n\nJuntos haremos historia \n\n#AMLOFest\n\nhttps://t.co/07FCWuD6SL'
1.01208E+18,27/06/2018 21:05,"b'Cerramos campa\xc3\xb1a en mi tierra, en mi agua. Estuvimos en Tuxtla y y Villahermosa. Est\xc3\xa1n mis paisanos, como todos los\xe2\x80\xa6 https://t.co/QmAfi9sjyV'"
1.01199E+18,27/06/2018 14:55,b'Les invito al Estadio Azteca al cierre de campa\xc3\xb1a. Empezar\xc3\xa1 el festival desde las 5 de la tarde. All\xc3\xa1 nos vemos. https://t.co/QNLKuGHAYJ'
1.01183E+18,27/06/2018 04:26,"b'Tambi\xc3\xa9n vamos a ganar la pen\xc3\xadnsula de Yucat\xc3\xa1n. Hoy fue la locura en Canc\xc3\xban, M\xc3\xa9rida y Campeche. Ma\xc3\xb1ana Tuxtla, Villa\xe2\x80\xa6 https://t.co/4BTF8QWLJz'"
1.01172E+18,26/06/2018 21:20,b'La serie del populismo en contra nuestra ser\xc3\xa1 exhibida por Amazon. Cost\xc3\xb3 100 millones de pesos y daban 100 mas para\xe2\x80\xa6 https://t.co/FzUX83sEw0'
1.01147E+18,26/06/2018 04:36,"b'Lamento el asesinato de Emigdio L\xc3\xb3pez Avenda\xc3\xb1o, candidato a diputado local en Ejutla, Oax. As\xc3\xad como el de Sa\xc3\xbal V\xc3\xa1sq\xe2\x80\xa6 https://t.co/FsWBzPUkId'"
1.01144E+18,26/06/2018 02:31,"b'Es necesario reorientar la pol\xc3\xadtica econ\xc3\xb3mica para producir en M\xc3\xa9xico, hasta donde sea posible, lo que consumimos y\xe2\x80\xa6 https://t.co/tYVdRko1DA'"
1.01133E+18,25/06/2018 19:43,"b'Estamos arriba con 25-30%, no hay que confiarse. La mafia del poder existe y los jefes est\xc3\xa1n desesperados. Es indis\xe2\x80\xa6 https://t.co/EDSRMtX2Gy'"
1.0111E+18,25/06/2018 04:30,"b'Cerramos campa\xc3\xb1a en Guanajuato y Jalisco, acompa\xc3\xb1amos a nuestros candidatos a gobernador, Ricardo Sheffield y Carlo\xe2\x80\xa6 https://t.co/DAquMRjMSt'"
1.01101E+18,24/06/2018 22:02,b'Est\xc3\xa1n muy activos Salinas y Fern\xc3\xa1ndez de Cevallos. Buscan desesperados la unidad del PRIAN; alientan la guerra suci\xe2\x80\xa6 https://t.co/uXe4DURWOZ'
1.01098E+18,24/06/2018 20:18,"b'Ante rumores infundados y perversos envi\xc3\xa9, desde San Luis Potos\xc3\xad, un mensaje a marinos y soldados de M\xc3\xa9xico. https://t.co/jaCnQpeOru'"
1.0109E+18,24/06/2018 14:57,"b'Estamos desayunando en el ""Caf\xc3\xa9 Pac\xc3\xadfico"", de San Luis Potos\xc3\xad, posiblemente las \xc3\xbaltimas gorditas de la campa\xc3\xb1a. Par\xe2\x80\xa6 https://t.co/v5v1eqtTPK'"
1.01072E+18,24/06/2018 02:54,"b'Cerramos con nuestros candidatos de Veracruz y Puebla, Cuitl\xc3\xa1huac Garc\xc3\xada y Miguel Barbosa. Enfrentamos la corrupci\xc3\xb3\xe2\x80\xa6 https://t.co/capiatbOgV'"
1.01035E+18,23/06/2018 02:47,"b'En la Macroplaza de Monterrey di a conocer que, al llegar al gobierno, ser\xc3\xa1 coordinador de la oficina de la Preside\xe2\x80\xa6 https://t.co/cuJkP83qQF'"
1.01014E+18,22/06/2018 12:46,"b'El Reforma, como emblema de la prensa conservadora, fif\xc3\xad, no es capaz de rectificar cuando difama, como lo hizo aye\xe2\x80\xa6 https://t.co/azHFlQwUmf'"
1.00954E+18,20/06/2018 20:41,"b'Este logro demuestra la nada despreciable fuerza de la opini\xc3\xb3n p\xc3\xbablica. ""Todo lo que resiste, apoya"".\n\nEn Los Reyes\xe2\x80\xa6 https://t.co/vzXsIAaJaD'"
1.00929E+18,20/06/2018 04:22,"b'El distintivo en esta \xc3\xbaltima etapa de campa\xc3\xb1a es la alegr\xc3\xada de la gente. As\xc3\xad se manifest\xc3\xb3 hoy, a pesar del calor y\xe2\x80\xa6 https://t.co/fZJFo0AA2q'"
1.00921E+18,19/06/2018 22:55,b'Encuesta nacional domiciliaria del fin de semana. Fue realizada por nuestros t\xc3\xa9cnicos de probada honestidad; no est\xe2\x80\xa6 https://t.co/UkBDzNuH3V'
1.00912E+18,19/06/2018 17:19,b'En defensa de los derechos humanos de los ni\xc3\xb1os deportados. \nhttps://t.co/CGXgLQJVN6'
1.00892E+18,19/06/2018 04:03,b'Miren c\xc3\xb3mo estuvo la otrora plaza p\xc3\xbablica prianista de Chihuahua. Fin a la farsa del gatopardismo. https://t.co/eFzYS9GTJE'
1.00886E+18,18/06/2018 23:58,b'En el cierre de campa\xc3\xb1a en Sonora jur\xc3\xa9 cumplir todos mis compromisos. Lo hice recordando a los yaquis y a los miner\xe2\x80\xa6 https://t.co/NbCWAunTsi'
1.00881E+18,18/06/2018 20:19,b'Cerramos campa\xc3\xb1a en Mexicali. Vamos a Hermosillo y m\xc3\xa1s tarde cerraremos campa\xc3\xb1a en Chihuahua. https://t.co/2un0EFzOfV'
1.00834E+18,17/06/2018 13:44,"b'Felicidades a bisabuelos, abuelos, padres j\xc3\xb3venes y solteros. Cari\xc3\xb1o eterno a nuestros finados padres.'"
1.00817E+18,17/06/2018 02:27,"b'Cerramos campa\xc3\xb1a en Morelos con Cuauht\xc3\xa9moc Blanco, candidato a gobernador. Sin caer en triunfalismos, todo indica q\xe2\x80\xa6 https://t.co/p8tEF7aeJX'"
1.00809E+18,16/06/2018 21:07,b'Cerramos campa\xc3\xb1a en Oaxaca con mucha gente de esp\xc3\xadritu combativo y fraterno. Reiter\xc3\xa9 que el pueblo de Oaxaca es de\xe2\x80\xa6 https://t.co/xt6yN9sTzL'
1.00781E+18,16/06/2018 02:33,"b'No es competencia, pero a\xc3\xban con el mundial de futbol, mucha gente est\xc3\xa1 apasionada, esperando la elecci\xc3\xb3n hist\xc3\xb3rica\xe2\x80\xa6 https://t.co/WaCjn1Qam6'"
1.00767E+18,15/06/2018 17:07,b'Si puedes y eres dem\xc3\xb3crata ayuda a defender el voto como representante de casilla de MORENA. https://t.co/YHB4a9HW0o'
1.00741E+18,14/06/2018 23:45,b'En Ciudad del Carmen estar\xc3\xa1 Pemex. Desde aqu\xc3\xad comenzar\xc3\xa1 el rescate de la industria petrolera. https://t.co/aido51V9bc'
1.00707E+18,14/06/2018 01:07,b'Estamos a 15 d\xc3\xadas de que termine la campa\xc3\xb1a y el \xc3\xa1nimo de la gente est\xc3\xa1 creciendo como si fuera a estallar de felic\xe2\x80\xa6 https://t.co/DUIhyzUycW'
1.00677E+18,13/06/2018 05:14,"b'Termin\xc3\xb3 el \xc3\xbaltimo debate, nos fue muy bien. Yo no he visto a Pe\xc3\xb1a desde hace 6 a\xc3\xb1os cuando se llevaron a cabo los d\xe2\x80\xa6 https://t.co/8BfBwMg049'"
1.00629E+18,11/06/2018 21:55,b'Estamos terminando en Las Margaritas y Comit\xc3\xa1n la gira de tres d\xc3\xadas por Chiapas. Aqu\xc3\xad nuestro candidato a gobernado\xe2\x80\xa6 https://t.co/XeAtXJrJUR'
1.00589E+18,10/06/2018 19:11,"b'En Tapachula, en la frontera de M\xc3\xa9xico con Guatemala, reafirm\xc3\xa9 el compromiso de desterrar la corrupci\xc3\xb3n y gobernar\xe2\x80\xa6 https://t.co/OQX17i1zQu'"
1.00564E+18,10/06/2018 02:34,"b'Hoy en La Fraylesca reafirm\xc3\xa9 el compromiso de lograr la soberan\xc3\xada alimentaria. Aqu\xc3\xad, hace 20 a\xc3\xb1os se produc\xc3\xada mucho\xe2\x80\xa6 https://t.co/avDf0Uu0qm'"
1.00529E+18,09/06/2018 03:26,"b'Nos est\xc3\xa1 funcionando bien el organismo, el coraz\xc3\xb3n resiste subidas y bajadas. Hoy salimos temprano de la Ciudad de\xe2\x80\xa6 https://t.co/GGbcMVzcHO'"
1.00438E+18,06/06/2018 15:28,"b'Estoy contento porque la capital de la rep\xc3\xbablica, la gran Ciudad de M\xc3\xa9xico con su pueblo libertario y fraterno, ser\xe2\x80\xa6 https://t.co/qAIIBlg87p'"
1.00419E+18,06/06/2018 02:46,b'Otro d\xc3\xada intenso de campa\xc3\xb1a: Dialogamos con integrantes del Consejo Mexicano de Negocios; presentamos agenda del me\xe2\x80\xa6 https://t.co/6sV1OgiGlV'
1.00366E+18,04/06/2018 15:21,"b'Se confirma, seguimos creciendo. Traemos 26 puntos de ventaja y tendencia al alza. https://t.co/NryxOzzkpz'"
1.00342E+18,03/06/2018 23:27,"b'Me reun\xc3\xad con Mois\xc3\xa9s Romano, presidente de la Comunidad Jud\xc3\xada. Desde que fui Jefe de Gobierno mantenemos buenas rela\xe2\x80\xa6 https://t.co/fr8jN51Y1v'"
1.00306E+18,02/06/2018 23:40,"b'Estuvimos en Ciudad Altaminario y en Tejupilco, la Tierra Caliente de Guerrero y Estado de M\xc3\xa9xico. https://t.co/0ZQGf8vn7u'"
1.00266E+18,01/06/2018 21:06,b'Un mensaje para los que est\xc3\xa1n organizando la defensa del voto. https://t.co/oP7gUkkgnw'
1.00237E+18,01/06/2018 01:43,"b'Estuvimos en la regi\xc3\xb3n pur\xc3\xa9pecha de Guanajuato y Michoac\xc3\xa1n; visitamos Uriangato, Puru\xc3\xa1ndiro, Zacapu y P\xc3\xa1tzcuaro. https://t.co/ogY6Q1lo8D'"
1.002E+18,31/05/2018 01:45,b'Vamos a impulsar el desarrollo del Istmo para comunicar el Pac\xc3\xadfico con la costa este de los Estados Unidos. \n\nHoy\xe2\x80\xa6 https://t.co/9vHuFlAtAx'
1.00182E+18,30/05/2018 13:52,b'La encuesta de hoy del Reforma nos obliga a redoblar esfuerzos. No aflojar el paso. Viene a la memoria aquella cons\xe2\x80\xa6 https://t.co/yfqxVUllUl'
1.00162E+18,30/05/2018 00:32,b'Respuesta a la carta de Germ\xc3\xa1n Larrea.\nhttps://t.co/vqmWainX01'
1.00128E+18,29/05/2018 01:51,b'Imaginen c\xc3\xb3mo estuvo el acto en Atlacomulco si as\xc3\xad fue la despedida. https://t.co/b6D3Dl2cm9'
1.00123E+18,28/05/2018 22:22,"b'Somos muchos los idealistas que llenamos las plazas. Como la de Zit\xc3\xa1cuaro en lunes a mediod\xc3\xada, en pleno sol; porque\xe2\x80\xa6 https://t.co/3xapdllkuU'"
1.00088E+18,27/05/2018 23:24,b'Beatriz hizo una propuesta con su soberana independencia y su absoluta responsabilidad https://t.co/ybCH4m4E1j'
1.00076E+18,27/05/2018 15:25,"b'Como es amigo de Beatriz, Javier Alatorre se meti\xc3\xb3 hasta la cocina. Les comparto la entrevista. https://t.co/lCx4OKD6qt'"
1.00012E+18,25/05/2018 21:08,b'Estuvimos en Iguala y lleg\xc3\xb3 una comisi\xc3\xb3n de los padres de los j\xc3\xb3venes desaparecidos de Ayotzinapa. Refrend\xc3\xa9 mi comp\xe2\x80\xa6 https://t.co/4XkfwMpXH0'
9.9983E+17,25/05/2018 01:51,b'Hoy estuvimos en cuatro delegaciones de la Ciudad de M\xc3\xa9xico y como pueden ver la gente sigue apoy\xc3\xa1ndonos con convic\xe2\x80\xa6 https://t.co/eOivkn2loA'
9.99717E+17,24/05/2018 18:23,"b'Bienvenida a Twitter, @BeatrizGMuller. https://t.co/51k5ZQ7yxk'"
9.99433E+17,23/05/2018 23:32,b'Es impresionante c\xc3\xb3mo est\xc3\xa1 respondiendo la gente. Nunca hab\xc3\xadan participado tantos ciudadanos como ahora en favor de\xe2\x80\xa6 https://t.co/Q4ZeU7WI6N'
9.99104E+17,23/05/2018 01:44,"b'De costa a costa y de frontera a frontera, en todas partes, se expresa la voluntad colectiva en favor del cambio ve\xe2\x80\xa6 https://t.co/IrWg86ouHg'"
9.98758E+17,22/05/2018 02:51,b'Por mi parte acuso de recibido y mando besos. https://t.co/EuD4pWiG2U'
9.98445E+17,21/05/2018 06:06,"b'\xc2\xa1Gracias, gracias, gracias! De todo coraz\xc3\xb3n. https://t.co/0c7EhBDL2z'"
9.98036E+17,20/05/2018 03:00,"b'Agregaron a la guerra sucia la distribuci\xc3\xb3n masiva de un volante, seg\xc3\xban el cual, ofendemos a la Virgen de Guadalupe\xe2\x80\xa6 https://t.co/cloHlVxBVP'"
9.97602E+17,18/05/2018 22:17,b'Voceros de la mafia del poder soltaron el rumor de que estoy enfermo. Antes asustaban porque supuestamente me iba a\xe2\x80\xa6 https://t.co/ou64HXx0tN'
9.97276E+17,18/05/2018 00:40,"b'La agenda de hoy consisti\xc3\xb3 en un di\xc3\xa1logo con la Coparmex; una asamblea en San Marcos, en la costa chica de Guerrero\xe2\x80\xa6 https://t.co/KsLnc0R3ki'"
9.96935E+17,17/05/2018 02:07,"b'Miren c\xc3\xb3mo est\xc3\xa1 Guanajuato, el otrora basti\xc3\xb3n panista. Estuvimos dos d\xc3\xadas con plazas llenas. https://t.co/Rek11OrqrS'"
9.96451E+17,15/05/2018 18:04,"b""Una convocatoria a los candidatos de la coalici\xc3\xb3n 'Juntos Haremos Historia':\n\nQue cada uno visitemos 150 domicilios\xe2\x80\xa6 https://t.co/oeoIB5EUGh"""
9.96192E+17,15/05/2018 00:54,"b'Les comparto esta canci\xc3\xb3n, \xc2\xabCu\xc3\xaddame t\xc3\xba\xc2\xbb, de Teresita Fern\xc3\xa1ndez, interpretada por Beatriz. https://t.co/qrVhYv4pHX'"
9.96031E+17,14/05/2018 14:13,"b'Estamos a 47 d\xc3\xadas de las elecciones hist\xc3\xb3ricas del primero de julio y gracias a ustedes estamos, por lo menos, 20 p\xe2\x80\xa6 https://t.co/VspGzSHuBu'"
9.9586E+17,14/05/2018 02:54,"b'Estuvimos en San Andr\xc3\xa9s Tuxtla, Cosamaloapan y Huatusco. En cada pueblo es una fiesta de alegr\xc3\xada y esperanza.\n\nComo\xe2\x80\xa6 https://t.co/d7jKwtcotv'"
9.955E+17,13/05/2018 03:03,"b'En Guelatao, Oaxaca, dimos a conocer los diez compromisos b\xc3\xa1sicos con la educaci\xc3\xb3n y el magisterio nacional \n\nhttps://t.co/dDvbSKfTka'"
9.95112E+17,12/05/2018 01:24,"b'En Puebla aparecieron mantas con la leyenda AMLO S\xc3\xad, Barbosa no. Pretenden restar votos a nuestros candidatos porqu\xe2\x80\xa6 https://t.co/BheeWrbPfe'"
9.94947E+17,11/05/2018 14:28,b'Me hicieron llegar esta encuesta en la cual votar\xc3\xadan por nosotros el 42 por ciento; el 51 por ciento de los ciudada\xe2\x80\xa6 https://t.co/iEYNbhOT3J'
9.94755E+17,11/05/2018 01:44,"b'La mayor\xc3\xada de la gente en Veracruz no quiere que Yunes Linares, gobernador del estado, deje a su hijo de gobernador\xe2\x80\xa6 https://t.co/6yyBvrfcRc'"
9.94589E+17,10/05/2018 14:45,b'\xc2\xa1Felicidades a las mam\xc3\xa1s en su d\xc3\xada! https://t.co/ugR7ierw1x'
9.94397E+17,10/05/2018 02:01,b'La gente est\xc3\xa1 feliz y contando los d\xc3\xadas para el primero de julio. Miren c\xc3\xb3mo est\xc3\xa1 la participaci\xc3\xb3n y el entusiasmo\xe2\x80\xa6 https://t.co/kodMzPFe9r'
9.93893E+17,08/05/2018 16:39,"b'En esta campa\xc3\xb1a, entre otras cosas favorables, contamos con una actitud m\xc3\xa1s abierta y plural de los medios de comun\xe2\x80\xa6 https://t.co/AM4ok4cUbo'"
9.93695E+17,08/05/2018 03:33,"b'Hoy fue d\xc3\xada intenso: por la ma\xc3\xb1ana estuvimos con empresarios del turismo; m\xc3\xa1s tarde con Laurence Fink, presidente d\xe2\x80\xa6 https://t.co/DnT2DGzYmw'"
9.93215E+17,06/05/2018 19:45,b'Reitero: respeto a los empresarios y Estado democr\xc3\xa1tico de derecho a la mafia del poder \n\nhttps://t.co/SsuqlM9lyU'
9.92967E+17,06/05/2018 03:20,"b'No estamos en contra de los empresarios, estamos en contra de la riqueza mal habida, la que obtienen de la noche a\xe2\x80\xa6 https://t.co/dJo4Paf50F'"
9.92809E+17,05/05/2018 16:51,"b'Ya estuvimos en Neza y mucha gente. Ahora vamos hacia Matehuala en San Luis Potos\xc3\xad y por la noche en Linares, NL.\xe2\x80\xa6 https://t.co/WviXypePvJ'"
9.92546E+17,04/05/2018 23:26,"b'Hoy nos acompa\xc3\xb1\xc3\xb3 Germ\xc3\xa1n Mart\xc3\xadnez en la gira por Yucat\xc3\xa1n. Para m\xc3\xad, el alumno m\xc3\xa1s destacado de Carlos Castillo Peraza\xe2\x80\xa6 https://t.co/eDTp7YHrl9'"
9.92434E+17,04/05/2018 16:02,"b'Ayer en Televisa fueron cr\xc3\xadticos, pero me dejaron hablar. Les comparto la entrevista.\nhttps://t.co/p4mZ8QO73P'"
9.92225E+17,04/05/2018 02:10,"b'Se desbord\xc3\xb3 el entusiasmo en Yautepec y Cuautla, Morelos. Record\xc3\xa9 aquello que dec\xc3\xada la gente cuando el sitio de Cua\xe2\x80\xa6 https://t.co/MmGxQ44Slx'"
9.91855E+17,03/05/2018 01:41,b'En la encuesta de Reforma traemos 18 puntos de ventaja; en la realizada por el Comit\xc3\xa9 T\xc3\xa9cnico de MORENA estamos 25\xe2\x80\xa6 https://t.co/AkgqTpBPzo'
9.91393E+17,01/05/2018 19:04,b'No tiene desperdicio la declaraci\xc3\xb3n de Lozano sobre las discrepancias al interior de la mafia del poder. Y todo por\xe2\x80\xa6 https://t.co/J25GlD3Ikn'
9.91139E+17,01/05/2018 02:13,b'As\xc3\xad vamos seg\xc3\xban nuestra medici\xc3\xb3n. Comparto encuesta telef\xc3\xb3nica realizada por la coordinaci\xc3\xb3n t\xc3\xa9cnica de MORENA el p\xe2\x80\xa6 https://t.co/pROcqRTVa4'
9.91032E+17,30/04/2018 19:12,"b'Acompa\xc3\xb1amos en Tepeaca a Miguel Barbosa, candidato al gobierno de Puebla.Tiene como adversaria a la esposa del exgo\xe2\x80\xa6 https://t.co/JdohT6GYcE'"
9.90754E+17,30/04/2018 00:47,"b'El acto de San Crist\xc3\xb3bal reafirma el resultado de una encuesta levantada el d\xc3\xada 24 de abril, de la empresa Focus, s\xe2\x80\xa6 https://t.co/tUnLWaTrxF'"
9.90703E+17,29/04/2018 21:21,"b'Iniciamos campa\xc3\xb1a en Palenque con Rutilio Escand\xc3\xb3n, candidato a gobernador en Chiapas. \n\nEn Palenque y Ocosingo cit\xe2\x80\xa6 https://t.co/i11JT6D14p'"
9.90414E+17,29/04/2018 02:14,"b'Seg\xc3\xban encuesta telef\xc3\xb3nica de Gabinete de Comunicaci\xc3\xb3n Estrat\xc3\xa9gica (25 de abril), en Tabasco tenemos 76%, Meade 7.5%\xe2\x80\xa6 https://t.co/QAAAfo85n0'"
9.90377E+17,28/04/2018 23:46,"b'Sin cucar a nadie, miren c\xc3\xb3mo nos fue en el acto de Comalcalco, ""La Perla de la Chontalpa"" https://t.co/Fa1AeM5Tg2'"
9.90332E+17,28/04/2018 20:47,"b'En mi tierra y en mi agua, con la\ngente y con Ad\xc3\xa1n, nuestro candidato a gobernador. https://t.co/uLKpMIu108'"
9.90256E+17,28/04/2018 15:45,"b""Gracias al joven trovador de 'Los Vales del Cerro'. \n\nEstamos saliendo al ed\xc3\xa9n; tendremos m\xc3\xadtines en C\xc3\xa1rdenas, Coma\xe2\x80\xa6 https://t.co/4yMZxpKQU8"""
9.89977E+17,27/04/2018 21:19,"b'Muy buen di\xc3\xa1logo circular con los estudiantes del Tec de Monterrey. Cr\xc3\xadticos, inteligentes y respetuosos. https://t.co/HmqmqCafCw'"
9.89606E+17,26/04/2018 20:43,"b'Agradezco al doctor Rodolfo Neri Vela su confianza. Es un gran cient\xc3\xadfico, el \xc3\xbanico astronauta mexicano y est\xc3\xa1 demo\xe2\x80\xa6 https://t.co/1NLYLdhzbf'"
9.89553E+17,26/04/2018 17:13,"b""Seg\xc3\xban la encuesta de 'Saba' crecimos despu\xc3\xa9s del debate. No pudieron trampearnos y por eso se intensifica la guerra\xe2\x80\xa6 https://t.co/DY1FMAs6oj"""
9.89142E+17,25/04/2018 14:01,b'Ante la guerra sucia hago un llamado a los ciudadanos de vocaci\xc3\xb3n democr\xc3\xa1tica y con dimensi\xc3\xb3n \xc3\xa9tica que interact\xc3\xbaan\xe2\x80\xa6 https://t.co/aW6gqoVlQQ'
