id,created_at,text
6.90934E+17,23/01/2016 16:28,"b'No ser\xc3\xa1 que Bono cobr\xc3\xb3 por fotografiarse en Davos, como ya sucedi\xc3\xb3 con un actor que se tom\xc3\xb3 una sellfie con EPN. Corrupci\xc3\xb3n y frivolidad'"
6.90382E+17,22/01/2016 03:55,"b'La devaluaci\xc3\xb3n se origina por factores externos, pero nos pega m\xc3\xa1s de la cuenta por la debilidad de la econom\xc3\xada y el sobreendeudamiento'"
6.90016E+17,21/01/2016 03:40,b'Estuve con el padre Solalinde y mujeres que luchan por el respeto a la diversidad y espacios para contribuir a la transformaci\xc3\xb3n del pa\xc3\xads'
6.89442E+17,19/01/2016 13:38,"b'Los del Reforma siguen tir\xc3\xa1ndonos lodo con la m\xc3\xa1xima del hampa del periodismo conservador de que ""la calumnia cuando no mancha tizna"".'"
6.89118E+17,18/01/2016 16:12,"b'Reforma, de mala leche, vuelve a ponerme en primera plana, haci\xc3\xa9ndole el paro a Mancera y me quiere igualar con corruptos. En Face aclaro'"
6.88922E+17,18/01/2016 03:12,b'EPN gasta mucho viajando sin beneficio para la Naci\xc3\xb3n. Afuera no lo toman en serio. Entre m\xc3\xa1s limpiemos nuestra casa m\xc3\xa1s respetados seremos.'
6.88396E+17,16/01/2016 16:22,b'EPN volvi\xc3\xb3 a huir. Evade responsabilidad. Candil de la calle y oscuridad de la casa. Ignora que la mejor pol\xc3\xadtica exterior es la interior.'
6.87832E+17,15/01/2016 03:00,b'Dice EPN que no vender\xc3\xa1 su nuevo avi\xc3\xb3n porque lo necesita. \xc2\xbfNo puede viajar en l\xc3\xadneas comerciales? \xc2\xbfQu\xc3\xa9 acaso la austeridad es populismo?'
6.8711E+17,13/01/2016 03:13,"b'En el caso de las c\xc3\xa1maras, hay que seguir la pista del dinero; de quen Chon las empresas concesionarias de las multas fantasmas.'"
6.86752E+17,12/01/2016 03:29,"b'A Luther King lo encarcelaron por manejar en ""exceso de velocidad"". En el DF, con el mismo pretexto, cobran multa, solo roban. ""Menos mal""'"
6.864E+17,11/01/2016 04:13,"b'Moreno Valle gasta en rueda de la fortuna, en estadio y telef\xc3\xa9rico, mientras crece la pobreza. Estuvimos 5 d\xc3\xadas en 20 municipios de Puebla'"
6.85669E+17,09/01/2016 03:45,"b'La reaprehensi\xc3\xb3n del Chapo nos revela que en M\xc3\xa9xico hay delincuentes de cuello blanco, tolerados y delincuentes rasos con impunidad relativa'"
6.85301E+17,08/01/2016 03:25,"b'Sigue detenida, injustamente, Nestora. Es presa de EPN y ante ello los tribunales act\xc3\xbaan por consigna y no sirven para impartir justicia'"
6.84928E+17,07/01/2016 02:43,"b'Al avi\xc3\xb3n de lujo de EPN le pondr\xc3\xa1n Jos\xc3\xa9 Mar\xc3\xada Morelos. Solo falta que le agreguen ""que se modere la indigencia y la opulencia"". C\xc3\xadnicos'"
6.84617E+17,06/01/2016 06:04,"b'El NYT cuestiona a EPN por la Casa Blanca, la fuga del Chapo y, sobre todo, por los 43 jovenes desaparecidos de Ayotzinapa. Aqu\xc3\xad silencio'"
6.84221E+17,05/01/2016 03:53,"b'Lamento y repudio el horrendo crimen de la edil de Temixco, Gisela Mota. Abrazo a sus familiares. Urge atender las causas de la violencia'"
6.82391E+17,31/12/2015 02:42,"b'Ojal\xc3\xa1 que los art\xc3\xadculos de Enrique Maza los recopile proceso en un libro, es el fil\xc3\xb3sofo mexicano de los pobres. Su autenticidad lo confirma'"
6.81316E+17,28/12/2015 03:27,"b'El nuevo reglamento de tr\xc3\xa1nsito, incluidas sus c\xc3\xa1maras, est\xc3\xa1 hecho para robar. MORENA lo cancelar\xc3\xa1. La autoridad del DF parece del PRIAN.'"
6.78658E+17,20/12/2015 19:25,b'Como en los mejores tiempos hicimos asamblea en Villahermosa. Acordamos ir a la elecci\xc3\xb3n extraordinaria y ganar el municipio del Centro'
6.78423E+17,20/12/2015 03:54,b'Terminamos en J\xc3\xa1ltipan gira de 5 d\xc3\xadas por 20 municipios de Veracruz. Estamos por llegar a Villahermosa. Ma\xc3\xb1ana mitin en la capital choca'
6.78043E+17,19/12/2015 02:45,b'Periodistas oficiales y oficiosos quieren justificar la compra del avi\xc3\xb3n de EPN. Lo bueno es que as\xc3\xad se sabr\xc3\xa1 m\xc3\xa1s sobre esta ostentaci\xc3\xb3n'
6.77531E+17,17/12/2015 16:47,"b'Abrazo a Jorge Alcocer Varela, investigador del Instituto de Nutrici\xc3\xb3n, por el Premio Nacional de Ciencias. Compa\xc3\xb1ero y amigo entra\xc3\xb1able'"
6.77326E+17,17/12/2015 03:15,b'Los del PAN usaron el alza al salario m\xc3\xadnimo como propuesta de campa\xc3\xb1a y ahora se quedaron callados con los 2 pesos 94 centavos de aumento'
6.76881E+17,15/12/2015 21:47,"b'Por suerte termin\xc3\xb3 el periodo en la C\xc3\xa1mara de Diputados porque, cuando sesionan solo sirven a la mafia y aprueban las pu\xc3\xb1aladas al pueblo'"
6.76579E+17,15/12/2015 01:45,"b'Por \xc3\xb3rdenes de Salinas, Manlio sali\xc3\xb3 a decir que va muy bien la econom\xc3\xada. Es tan cierto su dicho que la gasolina cuesta el doble que en EU'"
6.7627E+17,14/12/2015 05:17,"b'\xc2\xa1Como no te voy a querer! Felicidades, jugaste con entrega, nos apasionaste y, tambi\xc3\xa9n, demostraste que esto no se acaba hasta que se acaba'"
6.76232E+17,14/12/2015 02:48,"b'A pesar de toda la alharaca del gobierno de EPN y comparsa, el aumento al salario m\xc3\xadnimo fue otra vez un insulto: 2.94 pesos. Demagogos'"
6.75512E+17,12/12/2015 03:05,"b'En 7 d\xc3\xadas llega el lujoso avi\xc3\xb3n de Pe\xc3\xb1a. Solo adecuar la cabina, un \xc3\xa1rea de 223 m2, en lo t\xc3\xa9cnico y est\xc3\xa9tico, cost\xc3\xb3 35 millones de dolares'"
6.74783E+17,10/12/2015 02:49,"b'...electores, sino tambi\xc3\xa9n ser\xc3\xa1 costos\xc3\xadsimo. \xc2\xbfNo es mejor que la actual Asamblea se convierta en Constituyente? S\xc3\xad, pero la mafia dice no'"
6.74783E+17,10/12/2015 02:47,"b'El procedimiento para elaborar la nueva Constituci\xc3\xb3n del DF no solo es antidemocr\xc3\xa1tico, porque sit\xc3\xbaa a EPN y Mancera como los grandes...'"
6.74318E+17,08/12/2015 20:02,"b'Lamento la muerte del maestro de Chiapas. Ojal\xc3\xa1 y recapacite EPN. La reforma educativa no debe imponerse. Di\xc3\xa1logo y acuerdo, no violencia'"
6.73517E+17,06/12/2015 14:57,b'La encuesta de Reforma pas\xc3\xb3 por el departamento de corte y confecci\xc3\xb3n. Est\xc3\xa1n como los de Mitofsky-Televisa. Ojal\xc3\xa1 y as\xc3\xad nos dejen en paz.'
6.73344E+17,06/12/2015 03:29,"b'De los 2 ministros de la SCJN, uno ser\xc3\xa1 para el PRI y el otro para el PAN. EPN envi\xc3\xb3 las ternas y los senadores ""elegir\xc3\xa1n"". Pura farsa'"
6.72988E+17,05/12/2015 03:58,b'En Reforma aparece que se est\xc3\xa1n vendiendo franquicias de PEMEX para vender gasolina en EU y la burla mayor es que all\xc3\xa1 cuesta la mitad.'
6.72615E+17,04/12/2015 03:16,"b'EPN sigue siendo un personaje de la TV, ellos lo llevaron a la presidencia y su programa m\xc3\xa1s importante consiste en repartir pantallas.'"
6.72235E+17,03/12/2015 02:03,"b'Ayer cumpli\xc3\xb3 EPN 3 a\xc3\xb1os de desgobierno; es decir, de corrupci\xc3\xb3n, empobrecimiento y traici\xc3\xb3n. Es como para exclamar \xc2\xa1\xc3\xa1nimo ya falta menos!'"
6.71898E+17,02/12/2015 03:46,"b'El camino a Tlahualilo, Durango, est\xc3\xa1 destruido y en el centro de salud no hay rayos X, mientras EPN est\xc3\xa1 por estrenar un avi\xc3\xb3n lujos\xc3\xadsimo'"
6.71086E+17,29/11/2015 21:57,b'Apoyo la postura de los diputados de MORENA de no convertir el PENSIONISSSTE en Afore. Basta de privatizar ganancias y socializar p\xc3\xa9rdidas'
6.70063E+17,27/11/2015 02:12,"b'Ofenden a Ju\xc3\xa1rez en Oaxaca. Quieren ""educar"" con el garrote cuando el Benem\xc3\xa9rito dec\xc3\xada ""nada por la fuerza todo por la raz\xc3\xb3n y el derecho""'"
6.69703E+17,26/11/2015 02:24,"b'En Veracruz las carreteras de cuota est\xc3\xa1n destruidas. Por ejemplo, el tramo Coatzacoalcos-La Tinaja y ya ni hablar de las ""libres""'"
6.69343E+17,25/11/2015 02:31,"b'Dice el rufi\xc3\xa1n de CFE que en 21 a\xc3\xb1os, por AMLO, mis paisanos deben 10 mil millones de pesos, ellos han saqueado petr\xc3\xb3leo por 3.7 billones'"
6.69198E+17,24/11/2015 16:58,b'Les comparto dos entrevistas de radio con Sarmiento y Curzio. Respondo a capos y voceros https://t.co/aViJNTOGtX'
6.68772E+17,23/11/2015 12:45,"b'Hoy abri\xc3\xb3 campa\xc3\xb1a contra nosotros el peri\xc3\xb3dico Reforma, diciendo que pondr\xc3\xa9 ""diablitos"" en Tabasco. Ya tambi\xc3\xa9n ellos quieren desaforarnos'"
6.68631E+17,23/11/2015 03:22,"b'En Quintana Roo se disputan la plaza: la banda de Pedro Joaqu\xc3\xadn, que quiere imponer a su hermano de gobernador y la pareja F\xc3\xa9lix-Borge'"
6.68253E+17,22/11/2015 02:21,b'El equipo de veteranos de b\xc3\xa9isbol de MORENA DF gan\xc3\xb3 el campeonato nacional celebrado en Nuevo Le\xc3\xb3n. Felicito a mis compa\xc3\xb1eros.'
6.67898E+17,21/11/2015 02:51,b'Agradezco a los compa\xc3\xb1eros de MORENA que me eligieron Presidente. Vamos a crear una estructura organizativa s\xc3\xb3lida para ganar en el 2018'
6.67544E+17,20/11/2015 03:24,b'Ma\xc3\xb1ana recordamos en el Congreso de MORENA el inicio de la Revoluci\xc3\xb3n Mexicana con el compromiso de luchar por la justicia y la democracia'
6.672E+17,19/11/2015 04:37,b'El m\xc3\xa9todo para nombrar a los ministros de la SCJN lo estableci\xc3\xb3 \xc3\x81lvaro Obreg\xc3\xb3n. De esa manera el Poder Judicial no puede ser independiente'
6.66813E+17,18/11/2015 02:59,"b'Del actual aeropuerto al de Santa Luc\xc3\xada hay 35km y del JFK al de la Guardia, en Nueva York, 17km, pero EPN y socios dicen que no se puede'"
6.66098E+17,16/11/2015 03:38,"b'Terminamos gira de 4 d\xc3\xadas por 20 municipios de Zacatecas. Es bueno y est\xc3\xa1 trabajando el promotor de la soberan\xc3\xada nacional, David Monreal'"
6.65724E+17,15/11/2015 02:51,b'Pe\xc3\xb1a es candil de la calle y oscuridad de la casa. Viaja al extranjero sin ton ni son. Se fuga cada vez que puede a costillas del erario'
6.65362E+17,14/11/2015 02:55,"b'Es triste y lamentable la tragedia de Par\xc3\xads. Nada justifica la violencia,  menos cuando las v\xc3\xadctimas son civiles e inocentes'"
6.65034E+17,13/11/2015 05:10,b'Produce una gran satisfacci\xc3\xb3n el que se haya otorgado el Premio Cervantes al gran escritor mexicano Fernando del Paso. Enhorabuena'
6.64626E+17,12/11/2015 02:08,b'Hoy la Comisi\xc3\xb3n present\xc3\xb3 a las autoridades del GDF nuestro proyecto alternativo de aeropuerto. El viernes lo har\xc3\xa1 con el gobierno federal'
6.63913E+17,10/11/2015 02:55,"b'En 2004 se extra\xc3\xadan 3.4 millones de barriles diarios de petr\xc3\xb3leo y ahora 2.2 millones, y la gasolina m\xc3\xa1s cara que en EU y Guatemala. PRIAN'"
6.63558E+17,09/11/2015 03:24,"b'Despu\xc3\xa9s de Pe\xc3\xb1a, Moreno Valle es el m\xc3\xa1s represor de dirigentes sociales. En Puebla siguen presos inocentes con la complicidad de la CNDH'"
6.63171E+17,08/11/2015 01:47,b'El 18 de diciembre llega el lujoso avi\xc3\xb3n de 7500 millones de EPN. Los diputados de MORENA deben estar presentes e informar a los mexicanos'
6.62812E+17,07/11/2015 02:00,"b'Vean la foto del Consejo que inventaron los senadores donde aparecen tomando protesta Manlio, Jackson, Diego, Madero, entre otros. Da miedo'"
6.62294E+17,05/11/2015 15:43,"b'La Belisario Dom\xc3\xadnguez para Baill\xc3\xa8res y reeligen en el TSJDF a El\xc3\xadas Azar. Tiempos de decadencia, pero con presagios y vientos de cambio'"
6.61737E+17,04/11/2015 02:49,b'Nuestra propuesta alterna de aeropuerto es sustentable y significa un ahorro de 100 mil millones de pesos https://t.co/RA9zLDbXi3'
6.60666E+17,01/11/2015 03:51,b'Los de la mafia del poder controlan en lo absoluto a los medios convencionales de informaci\xc3\xb3n y ahora pretenden censurar las redes sociales'
6.6028E+17,31/10/2015 02:19,"b'Ante el abuso del GDF y de todos los partidos sat\xc3\xa9lites, apoyo a los asamble\xc3\xadstas de MORENA por rechazar Comisiones y legislar en el pleno'"
6.59802E+17,29/10/2015 18:40,b'El PRI quiere entregar a Baill\xc3\xa8res la medalla Belisario Dom\xc3\xadnguez. Meten en sus cochupos a los m\xc3\xa1rtires y ofenden su memoria. Se pasan'
6.59588E+17,29/10/2015 04:31,"b'La semana pasada sentimos la fuerza de las culturas zapoteca, chontal y huave, hoy la de los \xc3\xb1and\xc3\xba de Hidalgo. Con ello se regenera M\xc3\xa9xico'"
6.58505E+17,26/10/2015 04:45,"b'\xc2\xbfCu\xc3\xa1ndo dejar\xc3\xa1n libre a Nestora, Mireles y a otros dirigentes sociales injustamente encarcelados? \xc2\xbfSeguir\xc3\xa1 EPN aplicando la ley del embudo?'"
6.58136E+17,25/10/2015 04:21,"b'MORENA gan\xc3\xb3 en el DF, pero el acuerdo Mancera-PRI-PAN-PRD nos dej\xc3\xb3 sin presidencias de comisiones en la ALDF. Nombraron a incondicionales'"
6.57386E+17,23/10/2015 02:41,"b'PRI, PAN y PRD avalan, en la Asamblea Legislativa, la reelecci\xc3\xb3n del presidente del Tribunal de Justicia del DF. Son iguales de corruptos'"
6.57012E+17,22/10/2015 01:53,b'Es buena la decisi\xc3\xb3n de Gabino Cu\xc3\xa9 de hacer caso a Toledo y construir el Centro de Convenciones en otro sitio. Es de sabios rectificar'
6.56642E+17,21/10/2015 01:23,b'Es vergonzoso que el gobierno de EU castigue a M\xc3\xa9xico reduciendo un 30% la ayuda militar por violaci\xc3\xb3n a derechos humanos. El mundo al rev\xc3\xa9s'
6.55155E+17,16/10/2015 22:54,"b'La conferencia en Par\xc3\xads fue todo un \xc3\xa9xito. Mucha participaci\xc3\xb3n de mexicanos y franceses, con preguntas interesantes http://t.co/3uG0isbcPA'"
6.54774E+17,15/10/2015 21:42,b'Estoy en Par\xc3\xads. Ma\xc3\xb1ana dar\xc3\xa9 la conferencia La Lucha por el Renacimiento de M\xc3\xa9xico en Casa para Am\xc3\xa9rica Latina. Invito a paisanos de aqu\xc3\xad.'
6.54462E+17,15/10/2015 01:03,"b'Busqu\xc3\xa9 al Papa Francisco porque m\xc3\xa1s all\xc3\xa1 de ser cat\xc3\xb3lico, de otra religi\xc3\xb3n o libre pensador, es notorio que ha actuado de forma consecuente.'"
6.53358E+17,11/10/2015 23:55,b'Al Reforma: No recomend\xc3\xa9 a Nicol\xc3\xa1s Mollinedo para ocupar un cargo en la Cuauht\xc3\xa9moc. Estoy en contra del influyentismo y soy consecuente'
6.53009E+17,11/10/2015 00:47,"b'Es una infamia de EPN mantener en la c\xc3\xa1rcel a Nestora, Mireles y otros luchadores sociales solo por venganza. Demandemos su libertad'"
6.52647E+17,10/10/2015 00:47,"b'Fox dice que Pe\xc3\xb1a no es responsable de la violencia, en efecto, los responsables son los de la mafia en el poder que lo impusieron.'"
6.52327E+17,09/10/2015 03:36,b'Apareci\xc3\xb3 la noticia que el gobierno de EPN obtendr\xc3\xa1 un cr\xc3\xa9dito de 6 mil millones de d\xc3\xb3lares para el nuevo aeropuerto. Evitemos el atraco.'
6.51963E+17,08/10/2015 03:32,"b'Me enter\xc3\xa9 que con el nuevo aeropuerto no s\xc3\xb3lo cerrar\xc3\xa1n el actual, sino tambi\xc3\xa9n el militar de Santa Luc\xc3\xada. Es corrupci\xc3\xb3n e irracionalidad.'"
6.51579E+17,07/10/2015 02:03,"b'Un barril de petr\xc3\xb3leo que se vende en 39 d\xc3\xb3lares, deja 32 de ganancia. Con la privatizaci\xc3\xb3n, la Hacienda p\xc3\xbablica solo recibir\xc3\xa1 13.5 d\xc3\xb3lares'"
6.50888E+17,05/10/2015 04:19,"b'Mucho ojo, no se equivoquen, El Bronco encarna el salinismo, es independiente del pueblo, no de la mafia en el poder http://t.co/8NTy7IKb7V'"
6.5051E+17,04/10/2015 03:17,b'Dicen que lleg\xc3\xb3 el avi\xc3\xb3n de EPN de 7 mil millones de pesos. Cuando se confirme solicitar\xc3\xa9 filmarlo para exhibir la opulencia del fara\xc3\xb3n'
6.50146E+17,03/10/2015 03:09,b'Hoy se public\xc3\xb3 la convocatoria para j\xc3\xb3venes que quieran ingresar a universidades auspiciadas por MORENA. Ojal\xc3\xa1 y nos copien los salinistas'
6.49781E+17,02/10/2015 02:59,"b'Tomaron posesi\xc3\xb3n l@s jef@s delegacionales postulados por MORENA. Actuar\xc3\xa1n con honestidad, austeridad y en beneficio de los ciudadanos'"
6.49418E+17,01/10/2015 02:56,b'El gobernador saliente de Michoac\xc3\xa1n est\xc3\xa1 entregando notar\xc3\xadas a sus allegados. Es una pr\xc3\xa1ctica com\xc3\xban y corrupta que vamos desaparecer'
6.49038E+17,30/09/2015 01:48,b'Ma\xc3\xb1ana en el remate petrolero se est\xc3\xa1 pactando el 35% para PEMEX y el 65% a particulares. En el 18 cancelaremos estos contratos leoninos'
6.4835E+17,28/09/2015 04:14,"b'Ser\xc3\xada ofensivo para los oaxaque\xc3\xb1os, uno de los pueblos con m\xc3\xa1s cultura en el mundo, el regreso de la barbarie del PRI con Ulises o Murat'"
6.4777E+17,26/09/2015 13:51,"b'Mi p\xc3\xa9same a familiares y amigos de Hugo Guti\xc3\xa9rrez Vega. Gran poeta y escritor, amigo de Pellicer y Becerra, y de luchadores sociales.'"
6.47507E+17,25/09/2015 20:25,"b'Tiene raz\xc3\xb3n Toledo, que se haga el Centro de Convenciones pero no en el Fort\xc3\xadn. La consulta esta muy tendenciosa. Es de sabios rectificar'"
6.47226E+17,25/09/2015 01:46,b'El PRD-Gobierno se ali\xc3\xb3 con el PRIAN  para mayoritear a MORENA en la Asamblea Legislativa. Pero es mejor solos que juntarse con corruptos'
6.46511E+17,23/09/2015 02:24,"b'Quintana Roo es bot\xc3\xadn de corruptos. Los gobernadores, desde Coldwell hasta el actual, solo han significado frivolidad y delincuencia'"
6.45786E+17,21/09/2015 02:25,"b'Muy bien la mediaci\xc3\xb3n del papa Francisco para restablecer con respeto soberano y sin hegemon\xc3\xadas las relaciones Cuba y EU. Felicidades,'"
6.45263E+17,19/09/2015 15:48,b'Recordamos con cari\xc3\xb1o a las v\xc3\xadctimas del terremoto del 85. Abrazamos a sus familiares y exaltamos la solidaridad de los habitantes del DF'
6.44907E+17,18/09/2015 16:12,"b'Los magistrados del TRIFE negaron el recuento de votos en la Delegaci\xc3\xb3n GAM. C\xc3\xadnicos, corruptos y achichincles de la mafia en el poder'"
6.44711E+17,18/09/2015 03:14,"b'Carstens fue reelegido gobernador del BM. Lo ha hecho muy bien, no hay crecimiento, pero los financieros siguen especulando y @@@@@@@@'"
6.44306E+17,17/09/2015 00:24,"b'El PRD impugn\xc3\xb3 el recuento voto por voto, casilla por casilla en GAM. No cabe duda que terminaron como el PRIAN, sin principios ni verg\xc3\xbcenza'"
6.43871E+17,15/09/2015 19:34,"b'El personaje escenogr\xc3\xa1fico de Los Pinos hace unos d\xc3\xadas dijo que est\xc3\xa1bamos peor con Fox y Calder\xc3\xb3n. L\xc3\xa9ase, mal de muchos consuelo de Pe\xc3\xb1a'"
6.4361E+17,15/09/2015 02:20,"b'Una de cal por tantas de arena. Ante el fraude del PRD-Gobierno, el TRIFE orden\xc3\xb3 el recuento de votos en la delegaci\xc3\xb3n Gustavo A. Madero'"
6.43264E+17,14/09/2015 03:25,"b'EPN, en vez de rehabilitar el aeropuerto militar de Santa Luc\xc3\xada, a fuerza quiere hacer uno nuevo en 160 mil millones y todo por los moches'"
6.42904E+17,13/09/2015 03:33,"b'En Veracruz cambiar a Fidel Herrera y a Duarte por los Yunes, sea el del PRI o el del PAN, ser\xc3\xada m\xc3\xa1s de lo mismo. La opci\xc3\xb3n es MORENA'"
6.42524E+17,12/09/2015 02:22,"b'Por qu\xc3\xa9 tanto alboroto por el nombramiento de Escobar del Verde, en Gobernaci\xc3\xb3n, \xc2\xbfqu\xc3\xa9 acaso EPN,Videgaray, Chong o Manlio son distintos?'"
6.41818E+17,10/09/2015 03:39,b'EPN se reuni\xc3\xb3 con due\xc3\xb1os de OHL y les quit\xc3\xb3 la obligaci\xc3\xb3n de auditarlos sobre el n\xc3\xbamero de autos que pasan en las autopistas concesionadas'
6.41446E+17,09/09/2015 03:00,"b'Se ve\xc3\xada venir, el presupuesto 2016 propone una reducci\xc3\xb3n al gasto en educaci\xc3\xb3n y salud, acompa\xc3\xb1ado de deuda, disfrazada de bonos y (PPS)'"
6.41086E+17,08/09/2015 03:08,"b'Parece novela, pero cuando despertamos ya estaban de secretarios el hijo de De la Madrid y la sobrina de Carlos Salinas, o nunca se fueron'"
6.40719E+17,07/09/2015 02:50,"b'En Proceso, Zhenli Ye Gon dice que de los 205 millones de d\xc3\xb3lares que le confiscaron, 100 eran de la campa\xc3\xb1a de Calder\xc3\xb3n. El ""haiga sido...'"
6.4037E+17,06/09/2015 03:46,"b'A diferencia de Guatemala, en M\xc3\xa9xico, seg\xc3\xban la Constituci\xc3\xb3n, el presidente en funciones no puede ser juzgado por corrupci\xc3\xb3n. Es aberrante'"
6.3999E+17,05/09/2015 02:33,"b'El presidente depuesto en Guatemala dice que no acept\xc3\xb3 8 millones de d\xc3\xb3lares del Chapo. EPN ""gan\xc3\xb3"" con dinero il\xc3\xadcito y continua impune'"
6.39621E+17,04/09/2015 02:09,"b'En comparaci\xc3\xb3n con EPN, el presidente de Guatemala es un aprendiz de carterista. Sin embargo, en ese pa\xc3\xads no hay impunidad como en M\xc3\xa9xico'"
6.3921E+17,02/09/2015 22:54,"b'A pesar del da\xc3\xb1o que causa, el corrupto y c\xc3\xadnico de EPN, no habl\xc3\xb3 de su renuncia. Por menos, en Guatemala est\xc3\xa1n enjuiciando al presidente'"
6.38947E+17,02/09/2015 05:31,b'Muy buena la iniciativa de Ley de Austeridad que present\xc3\xb3 Rocio Nahle a nombre del grupo parlamentario de MORENA. Es  hablar con hechos'
6.38546E+17,01/09/2015 02:55,"b'No es novedad que TEDF rechace el recuento de votos, es parte de la antidemocracia y del contubernio entre ese organismo, el PRD y el GDF.'"
6.38201E+17,31/08/2015 04:05,"b'Los pueblos de Oaxaca, por sus culturas, mantienen la organizaci\xc3\xb3n social comunitaria y la ayuda mutua que mitigan en lo posible la pobreza'"
6.37809E+17,30/08/2015 02:06,b'No aclar\xc3\xb3 Videgaray al reportero de Reforma sobre las obras de arte que entreg\xc3\xb3 en pago por su casa en Malinalco. \xc2\xbfY la transparencia?'
6.37455E+17,29/08/2015 02:42,"b'Se supo que Videgaray pag\xc3\xb3 la casa que ""compr\xc3\xb3"" a Higa en diciembre de 2014, cuando hab\xc3\xada dicho que fue antes de entrar a la SHCP. Pillo'"
6.37099E+17,28/08/2015 03:08,b'Los cambios de EPN no incluyeron a los responsables de la fuga del Chapo ni a los causantes de la crisis econ\xc3\xb3mica y de la corrupci\xc3\xb3n'
6.36735E+17,27/08/2015 02:59,b'Llevan 11 meses desaparecidos los j\xc3\xb3venes de Ayotzinapa. No hay justicia y la nueva procuradora ni siquiera ha informado. Buscan el olvido'
6.36368E+17,26/08/2015 02:41,b'Mi solidaridad con el periodista Jorge Ramos. Nadie debe coartar la libertad. En la democracia es consustancial el derecho a disentir'
6.35616E+17,24/08/2015 00:53,"b'Nestora lleva 2 a\xc3\xb1os encarcelada injustamente. Sabemos que EPN es autoritario, pero indigna el silencio c\xc3\xb3mplice del presidente de la CNDH'"
6.35252E+17,23/08/2015 00:49,b'Se puede aumentar en 10 millones de toneladas la producci\xc3\xb3n de ma\xc3\xadz con semillas nativas y ser autosuficientes. No al ma\xc3\xadz transg\xc3\xa9nico'
6.34577E+17,21/08/2015 04:04,"b'El mafioso de Beltrones, impuesto por Salinas en el PRI, tiene el encargo de enfrentarnos para impedir el cambio y perpetuar la corrupci\xc3\xb3n'"
6.34199E+17,20/08/2015 03:02,"b'Rockefeller dec\xc3\xada que el petr\xc3\xb3leo era el mejor negocio del mundo; ten\xc3\xada raz\xc3\xb3n, sin embargo, la mafia mexicana lo convirti\xc3\xb3 en vil baratija'"
6.33118E+17,17/08/2015 03:29,"b'Los conservadores deber\xc3\xadan aceptar que sus tecn\xc3\xb3cratas les ayudan, pero han endeudado al pa\xc3\xads y quebrado la econom\xc3\xada como pocos en el mundo'"
6.32763E+17,16/08/2015 03:58,"b'Agobia tanto la ineptitud y la corrupci\xc3\xb3n en el gobierno de EPN que parece como el fin del sexenio, cuando faltan 3 a\xc3\xb1os m\xc3\xa1s de pesadilla.'"
6.32373E+17,15/08/2015 02:07,"b'Manlio es servicial, le ayuda a traficantes de influencia, a pol\xc3\xadticos corruptos, contratistas, informadores, pero le da miedo a la gente'"
6.32021E+17,14/08/2015 02:48,"b'El colmo: optaron por entregar la renta petrolera y ahora Carstens advierte desinter\xc3\xa9s ""de los inversionistas por la reforma energ\xc3\xa9tica""'"
6.31304E+17,12/08/2015 03:18,b'Debe cancelarse la construcci\xc3\xb3n del nuevo aeropuerto. Es un vil negocio de pol\xc3\xadticos y contratistas. Es mejor habilitar el de Santa Luc\xc3\xada'
6.30948E+17,11/08/2015 03:45,"b'Es una verg\xc3\xbcenza que EPN permanezca indolente, mientras est\xc3\xa1n en la c\xc3\xa1rcel Nestora, Mireles y otros inocentes. Me hiere su frivolidad.'"
6.30566E+17,10/08/2015 02:27,b'En el Consejo de MORENA se acord\xc3\xb3 crear una comisi\xc3\xb3n que proponga el qu\xc3\xa9 hacer ante la perversidad de la compra del voto'
6.29839E+17,08/08/2015 02:18,b'El traslado del Gobernador Electo de Nuevo Le\xc3\xb3n a Colombia en un avi\xc3\xb3n de un contratista demuestra su nivel de independencia y honestidad'
6.29108E+17,06/08/2015 01:54,"b'Ojal\xc3\xa1 EPN ofrezca algo alentador antes del Informe. Por ejemplo, que renovara al gabinete. Aunque lo que se requiere es un cambio de r\xc3\xa9gimen'"
6.28745E+17,05/08/2015 01:49,b'Mi p\xc3\xa9same a familiares y amigos de Rub\xc3\xa9n Espinosa y las cuatro mujeres asesinadas arteramente. Que se investigue a fondo y se haga justicia.'
6.284E+17,04/08/2015 03:01,"b'Seguimos trabajando en el proyecto para la fundaci\xc3\xb3n de universidades y garantizar que, donde gobierne MORENA, ning\xc3\xban joven sea rechazado'"
6.28028E+17,03/08/2015 02:22,"b'Ojal\xc3\xa1 la encuesta del Reforma, donde estamos arriba, no lleve a la guerra sucia u otra campa\xc3\xb1a como la del ""peligro para M\xc3\xa9xico""'"
6.27269E+17,01/08/2015 00:05,"b'La encuesta del Reforma revela la debacle de EPN, pero lo m\xc3\xa1s preocupante es el pasmo de la clase pol\xc3\xadtica ante la crisis de M\xc3\xa9xico'"
6.26928E+17,31/07/2015 01:29,"b'Si no estuviese de por medio la gente de Sonora, ser\xc3\xada hasta divertido asomarse a ver al mafioso de Manlio atacando al corrupto de Padr\xc3\xa9s'"
6.26582E+17,30/07/2015 02:36,b'Es una verg\xc3\xbcenza que los directores de PEMEX y CFE est\xc3\xa9n al servicio de Oteyza gerente en M\xc3\xa9xico de la empresa OHL de Espa\xc3\xb1a. Oigan el audio'
6.26232E+17,29/07/2015 03:23,"b'En M\xc3\xa9xico se puede despedir al entrenador de la selecci\xc3\xb3n nacional de f\xc3\xbatbol, pero EPN, el gabinete de seguridad y Videgaray no renuncian'"
6.25498E+17,27/07/2015 02:47,"b'Callaron ""cuando solo pas\xc3\xb3 el examen"" de la UNAM el 10% y ahora hacen un esc\xc3\xa1ndalo porque el 46% de los maestros resultaron ""no id\xc3\xb3neos""'"
6.24758E+17,25/07/2015 01:47,"b'En el programa Sin Hambre: les dieron su pantalla, les compraron el voto y ahora les aumentan el precio de la leche Liconsa de 4.50 a 5.50'"
